1001896054,"John Deere tractors cruises down a street , while the driver wears easy to see clothing .",866,tractor,"truck,person,driving,tractor,people,sit,road","tractor,cruise,street,driver,wear,easy,clothing"
1011572216,A beautiful bride walking on a sidewalk with her new husband .,982,"groom, bridegroom","car,cell,phone,person,tie,arranging,flowers,couple,people,stand","beautiful,bride,walk,sidewalk,new,husband"
101669240,A person wearing skis looking at framed pictures set up in the snow .,795,ski,"person,ski,skiing,crosscountry,man,black,jacket,white,photo,ski","person,wear,ski,look,framed,picture,set,snow"
102998070,Three old men are watching another man prepare fish .,544,Dutch oven,"bowl,person,cooking,on,campfire,group,people,stand,table,food","old,man,watch,man,prepare,fish"
1030985833,A black dog and a brown dog are jumping up to catch a red toy .,208,Labrador retriever,"frisbee,dog,training,dog,dog,stand,grass,dog","black,dog,brown,dog,jump,catch,red,toy"
103953336,Person crossing a bridge in dim light .,839,suspension bridge,"person,playing,tennis,red,white,stand,bridge","person,cross,bridge,dim,light"
1056873310,Two dogs run towards each other on a rocky area with water in the background .,225,malinois,"dog,training,dog,brown,horse,walk,water","dog,run,rocky,area,water,background"
105806535,"A man holding a yellow ball , soaking in a wooden tub .",876,"tub, vat","bicycle,person,trimming,or,shaving,beard,woman,sit,middle,water","man,hold,yellow,ball,soak,wooden,tub"
106027774,A man asleep in a car that 's driving .,785,"seat belt, seatbelt","person,playing,xylophone,man,sit,car","man,asleep,car,drive"
1061467336,Firefighters at a scene with a firetruck that has it 's lights on .,555,"fire engine, fire truck","car,bus,person,kicking,soccer,ball,people,stand,fire,truck","firefighter,scene,firetruck,light"
106490881,A boy in his blue swim shorts at the beach .,842,"swimming trunks, bathing trunks","person,getting,a,haircut,man,stand,water,arm","boy,blue,swim,short,beach"
106514190,A skier is overlooking a snow-covered mountain .,970,alp,"backpack,person,skiing,-not,slalom,or,crosscountry-,person,ski,hill,snow,cover,background","skier,overlook,snow,cover,mountain"
1065831604,A bunch of people in racing gear and helmets racing bicycles around a corner on wet pavement .,444,"bicycle-built-for-two, tandem bicycle, tandem","bicycle,bottle,person,riding,mountain,bike,people,ride,bike,air","bunch,people,race,gear,helmet,race,bicycle,corner,wet,pavement"
107318069,A crowd watching air balloons at night .,417,balloon,"kite,person,kicking,soccer,ball,large,large,red,white,animal,background","crowd,watch,air,balloon,night"
1073444492,"Man talking on a phone , surrounded by books in an office .",454,"bookshop, bookstore, bookstall","chair,person,book,sign,language,interpreting,library,book,book,book","man,talk,phone,surround,book,office"
1087539207,The children played on the four wheeler in the field .,621,"lawn mower, mower","surfboard,motorcycle,person,swinging,on,something,man,ride,grass","child,play,wheeler,field"
108898978,Two people wearing yellow jackets crosscountry skiing .,795,ski,"backpack,person,ski,dancing,charleston,people,ski,hill","people,wear,yellow,jacket,crosscountry,skiing"
108957912,People walk across a street as utility workers fix a light .,920,"traffic light, traffic signal, stoplight","person,traffic,light,handbag,tai,chi,crowd,people,walk,street,building","people,walk,street,utility,worker,fix,light"
109202756,A woman rides a horse near a frozen lake in the winter time .,339,sorrel,"horse,person,riding,or,walking,with,horse,woman,ride,horse,snow","woman,ride,horse,frozen,lake,winter,time"
109202801,Two draft horses pull a cart through the snow .,603,"horse cart, horse-cart","horse,person,grooming,horse,horse,pull,horse,street","draft,horse,pull,cart,snow"
1092437557,Woman is enjoying herself being outdoors biking in a forrest preserve .,671,"mountain bike, all-terrain bike, off-roader","bicycle,person,riding,mountain,bike,man,ride,bike,bike","woman,enjoy,bike,forr,preserve"
109544260,Young boy sitting down outside and blowing bubbles .,971,bubble,"bottle,person,contact,juggling,young,boy,sit,ground,leg","young,boy,sit,blow,bubble"
1095476286,a boy plays in the fountains .,562,fountain,"person,tying,knot,-not,on,a,tie-,group,people,stand,water","boy,play,fountain"
1095580424,The dog is running out of the tunnel on a dog obedience course .,264,"Cardigan, Cardigan Welsh corgi","couch,dog,cutting,nails,dog,lay,beach,dog","dog,run,tunnel,dog,obedience,course"
1096395242,A little boy in orange shorts playing with a toy .,971,bubble,"sport,ball,backpack,person,hair,drier,playing,harmonica,young,child,hold,toothbrush,mouth","little,boy,orange,short,play,toy"
109656696,A little girl balances on a gymnastics beam .,416,"balance beam, beam","person,tap,dancing,young,boy,ride,skateboard","little,girl,balance,gymnastics,beam"
109738763,A snowmobile rider flies through the air on his or her machine in front of tall pine trees .,802,snowmobile,"motorcycle,person,swimming,butterfly,stroke,people,sit,road","snowmobile,rider,fly,air,machine,tall,pine,tree"
109738916,People pose with helmets and goggles on while riding snowmobiles .,802,snowmobile,"motorcycle,person,riding,mountain,bike,people,sit,red,red","people,pose,helmet,goggle,ride,snowmobile"
1099434461,A man is cooking a square pancake : he lifts it with his fingers and a spatula to check to see if it is done .,813,spatula,"pizza,cup,bottle,person,flipping,pancake,person,cut,dough,half,pizza","man,cook,square,pancake,lift,finger,spatula,check"
1100214449,A happy boy is jumping in front OD city fountain .,562,fountain,"person,juggling,soccer,ball,young,boy,trick,water","happy,boy,jump,od,city,fountain"
1101291373,A bald man in flip-flops sits on a green bench and talks on a cellphone .,703,park bench,"bench,person,handbag,sign,language,interpreting,woman,sit,bench,talk,bench","bald,man,flip,flop,sit,green,bench,talk,cellphone"
110201971,Three men seated on an elephant in a small village .,385,"Indian elephant, Elephas maximus","elephant,bench,person,riding,elephant,elephant,stand,dirt","man,seat,elephant,small,village"
1104133405,A boy carrying a soccer ball .,805,soccer ball,"bench,sport,ball,person,throwing,discus,young,boy,play,baseball","boy,carry,soccer,ball"
1105959054,An artist paints clouds onto a canvas .,696,paintbrush,"person,refrigerator,brush,painting,man,hold,board,bathroom","artist,paint,cloud,canvas"
110647073,Men are constructing a wall in the desert .,428,"barrow, garden cart, lawn cart, wheelbarrow","person,mowing,lawn,group,people,sit,bench,sand","man,construct,wall,desert"
1107246521,A black dog playing fetch with a ball of rope .,205,flat-coated retriever,"bird,dog,training,dog,dog,run,air,dog","black,dog,play,fetch,ball,rope"
1107507919,A woman in a red shirt plays a cello .,486,"cello, violoncello","chair,person,playing,cello,woman,sit,middle,water","woman,red,shirt,play,cello"
110802332,A hockey goalie is trying to prevent a goal from the opposing team .,746,"puck, hockey puck","person,ski,playing,ice,hockey,man,red,shirt,ski,snow,cover,slope","hockey,goalie,try,prevent,goal,oppose,team"
111061041,Two men in a tennis court in a city are standing on either side of the net talking to each other .,489,chainlink fence,"tennis,racket,person,hitting,baseball,group,people,play,tennis,court","man,tennis,court,city,stand,net,talk"
111537217,The young man with the white t-shirt and jeans is rappeling up the rock wall .,972,"cliff, drop, drop-off","person,rock,climbing,man,sit,rock,cell,phone","young,man,shirt,jean,rappel,rock,wall"
111766423,A black and white bird standing on a hand .,19,chickadee,"bird,person,feeding,birds,small,bird,sit,small,bird","black,white,bird,stand,hand"
111796099,A game of tennis is shown with one of the female players about to hit the ball .,752,"racket, racquet","sport,ball,chair,tennis,racket,person,playing,tennis,tennis,player,court,tennis,racket","game,tennis,show,female,player,hit,ball"
1118168796,A man looks through a large camera-like device in a field near a camper and some parked vehicles .,872,tripod,"truck,chair,person,car,bending,metal,white,image","man,look,large,camera,like,device,field,camper,park,vehicle"
1130295306,A boy wearing a rugby shirt standing next to a body of water .,975,"lakeside, lakeshore","person,handbag,riding,scooter,man,ride,river","boy,wear,rugby,shirt,stand,body,water"
1130369873,A brown dog swims through water outdoors with a tennis ball in its mouth .,211,"vizsla, Hungarian pointer","sport,ball,dog,jumping,into,pool,brown,dog,hold,dog,water","brown,dog,swim,water,tennis,ball,mouth"
1130401779,Two brown dogs in the water .,211,"vizsla, Hungarian pointer","dog,training,dog,brown,brown,dog,stand,water","brown,dog,water"
1131889107,A women 's roller derby team taking a break .,615,knee pad,"suitcase,person,handbag,brushing,teeth,group,people,sit,sidewalk,hand","woman,roller,derby,team,take,break"
1141718391,Woman and man walking across wooden rope bridge with a caution sign beside it .,839,suspension bridge,"person,handbag,presenting,weather,forecast,people,stand,middle,bridge","woman,man,walk,wooden,rope,bridge,caution,sign"
1141739219,A girl climbing down from the side of a bright blue truck while others watch .,569,"garbage truck, dustcart","truck,backpack,person,jumping,into,pool,group,people,stand,truck","girl,climb,bright,blue,truck,watch"
114410209,A young man standing in front of a red freight car holding a camera and taking a photo .,565,freight car,"train,person,pull,ups,red,red,train,train,track","young,man,stand,red,freight,car,hold,camera,take,photo"
1146490295,A man in a white shirt is talking with two men and two women sitting on a bench .,433,"bathing cap, swimming cap","bench,backpack,person,handbag,climbing,tree,group,people,sit,bench","man,white,shirt,talk,man,woman,sit,bench"
1147391743,Several African women sit in front of a hut .,830,stretcher,"person,weaving,basket,group,people,sit,sandy,beach","african,woman,sit,hut"
1148238960,People on bicycles waiting at an intersection .,880,"unicycle, monocycle","bicycle,person,pot,plant,car,backpack,traffic,light,riding,unicycle,man,ride,bike,street,people","people,bicycle,wait,intersection"
1149097018,An infant lays on a bed with it 's mouth open .,443,bib,"person,playing,drums,baby,lay,bed,baby","infant,lay,bed,mouth,open"
1149179852,A shirtless man escorts a horse pulling a carriage along a paved road .,603,"horse cart, horse-cart","horse,person,riding,or,walking,with,horse,horse,draw,carriage,pull,cart,people","shirtless,man,escort,horse,pull,carriage,paved,road"
1154080132,Three young boys are fishing at a lake .,758,reel,"backpack,person,swinging,on,something,people,stand,edge,boat","young,boy,fish,lake"
116002648,A young child is sleeping on a man 's coat on the floor .,797,sleeping bag,"bed,person,eating,cake,woman,lay,bed,dog","young,child,sleep,man,coat,floor"
1160841776,people enjoying a sunny day at the beach,978,"seashore, coast, seacoast, sea-coast","person,canoeing,or,kayaking,group,people,ride,beach,beach","people,enjoy,sunny,day,beach"
1162606352,Two girls with pots show off their cooking .,822,steel drum,"bowl,person,flipping,pancake,woman,stand,kitchen,food","girl,pot,cooking"
1164765687,A man in a red shirt is giving toys to a small dog .,201,"silky terrier, Sydney silky","bed,teddy,bear,person,dog,grooming,dog,man,lay,couch,dog","man,red,shirt,give,toy,small,dog"
1167908324,A man stands next to three video machines .,800,"slot, one-armed bandit","person,tv,using,remote,controller,-not,gaming-,man,hold,open,blue,white","man,stand,video,machine"
1176580356,A big dog catches a ball on his nose,191,"Airedale, Airedale terrier","sport,ball,dog,playing,basketball,dog,stand,frisbee","big,dog,catch,ball,nose"
118647903,"Two soccer players , one in red , the other in white , racing towards a soccer ball .",805,soccer ball,"sport,ball,person,kicking,soccer,ball,boy,play,soccer,soccer,field","soccer,player,red,white,race,soccer,ball"
118668756,A little boy kicking a rubber ball .,805,soccer ball,"sport,ball,person,kicking,soccer,ball,boy,play,soccer,grass","little,boy,kick,rubber,ball"
1187435567,A small brown and black dog playing with a toy,201,"silky terrier, Sydney silky","bed,dog,curling,hair,small,dog,sit,couch","small,brown,black,dog,play,toy"
1188199432,Five little kids are taking a ride in some type of amusement park .,417,balloon,"train,person,swinging,on,something,group,people,stand,build","little,kid,take,ride,type,amusement,park"
1193116658,A girl rides a unicycle with a child who rides a scooter .,880,"unicycle, monocycle","bicycle,person,riding,scooter,man,ride,bike,street","girl,ride,unicycle,child,ride,scooter"
1199847613,Men and women wearing white swim caps giving each other piggyback rides .,433,"bathing cap, swimming cap","person,playing,didgeridoo,group,people,sit,cell,phone","man,woman,wear,white,swim,cap,give,piggyback,ride"
1215804065,Someone parasailing with a green parachute that has a face on the top of it,701,"parachute, chute","kite,person,brushing,teeth,person,fly,kite,water","parasaile,green,parachute,face"
121800200,Many people are climbing the mountain surrounded by pretty green trees .,972,"cliff, drop, drop-off",",rock,climbing,group,people,stand,middle,road","people,climb,mountain,surround,green,tree"
1222322358,A child looking back on a fast moving swing .,843,swing,"person,swinging,on,something,young,girl,hold,camera,camera","child,look,fast,move,swing"
122301379,Two men with a chainsaw fell trees in a leafless forest .,491,"chain saw, chainsaw","person,playing,accordion,man,stand,forest,tree,tree","man,chainsaw,fall,tree,leafless,forest"
122958692,"Tennis player uses backhand in a match , possibly a doubles match .",752,"racket, racquet","sport,ball,tennis,racket,person,playing,tennis,man,white,shirt,hold,tennis,racquet","tennis,player,use,backhand,match,double,match"
1230594535,"A young woman in jeans stands on a window ledge , cleaning a window .",608,"jean, blue jean, denim","person,pot,plant,eating,cake,woman,stand,mirror","young,woman,stand,window,ledge,clean,window"
1231348815,Displaying a big smile and a thumbs up this man is holding up a carriage .,612,"jinrikisha, ricksha, rickshaw","bicycle,person,boat,opening,bottle,man,elephant","display,big,smile,thumb,man,hold,carriage"
1234206849,Two women donning hats adorned with flowers pose for a picture .,808,sombrero,"person,riding,mountain,bike,woman,wear,hat,hat,hat","woman,don,hat,adorn,flower,pose,picture"
123728333,A smiling elderly man is creating pottery .,739,potter's wheel,"dining,table,person,clay,pottery,making,man,hold,old,pottery,pottery","smile,elderly,man,create,pottery"
1238849490,a crowd gathers around a lady with an acoustic guitar who is performing,879,umbrella,"umbrella,person,catching,or,throwing,frisbee,woman,hold,umbrella,hold,umbrella","crowd,gather,lady,acoustic,guitar,perform"
12393802,"A man at work , butchering a cow .",467,"butcher shop, meat market","person,playing,didgeridoo,man,stand,wooden,table,umbrella","man,work,butcher,cow"
12424190,A man sleeps in a hammock next to water and a boat .,797,sleeping bag,"bed,person,boat,bench,pressing,man,sit,bench,water","man,sleep,hammock,water,boat"
1244140539,A small dog shakes its head on a white shag carpet .,201,"silky terrier, Sydney silky","bed,chair,dog,playing,xylophone,small,dog,dog,floor","small,dog,shake,head,white,shag,carpet"
124881487,A man rides his dirt bike down a rocky trail .,671,"mountain bike, all-terrain bike, off-roader","bicycle,backpack,person,riding,mountain,bike,man,ride,bike,dirt,road","man,ride,dirt,bike,rocky,trail"
1248953128,Young girl in blue dress stepping over a soccer ball .,805,soccer ball,"bench,sport,ball,person,kicking,soccer,ball,little,girl,play,soccer,grass","young,girl,blue,dress,step,soccer,ball"
1250181412,Six people ride mountain bikes through a jungle environment .,671,"mountain bike, all-terrain bike, off-roader","bicycle,person,riding,mountain,bike,group,people,stand","people,ride,mountain,bike,jungle,environment"
1252210354,"A young man , with billowy red-hair , lines up his shot of the 9 ball on a pool table .",736,"pool table, billiard table, snooker table","sport,ball,chair,person,golf,putting,close,apple,remote,control","young,man,red,hair,line,shot,ball,pool,table"
125272627,A group of women having drinks in at a table in a cafe bookstore .,624,library,"chair,person,handbag,dine,table,bottle,cup,tasting,beer,group,people,sit,table,people","group,woman,have,drink,table,cafe,bookstore"
125319704,Person standing beside bike in stream .,671,"mountain bike, all-terrain bike, off-roader","bicycle,person,riding,mountain,bike,man,ride,bike,rock,rock","person,stand,bike,stream"
125635185,"Three children are playing outdoors , two of them on a metal barrel swing .",843,swing,"person,drinking,beer,man,sit,barrel","child,play,metal,barrel,swing"
1262077938,A woman with a handbag is sitting on a wooden bench .,703,park bench,"bench,car,person,handbag,holding,snake,woman,sit,bench,reading,book","woman,handbag,sit,wooden,bench"
126762293,A male gymnast leaps over a stack of wooden platforms .,416,"balance beam, beam","person,holding,snake,skateboard,jump,ramp,air","male,gymnast,leap,stack,wooden,platform"
1269470943,Boy is lying face down in the grass with his foot on a football .,522,croquet ball,"sport,ball,person,high,kick,young,boy,lay,ground,grass","boy,lie,face,grass,foot,football"
1271210445,A birthday celebration taking place for a girl who has reached age 5 .,470,"candle, taper, wax light","bowl,cake,person,wine,glass,blowing,out,candles,woman,sit,cake,candle","birthday,celebration,take,place,girl,reach,age"
128391889,Kids play a game of ball with paddles at the water 's edge at the beach .,842,"swimming trunks, bathing trunks","frisbee,person,surfboard,catching,or,throwing,frisbee,group,people,stand,beach,surfboard","kid,play,game,ball,paddle,water,edge,beach"
128396110,A man wearing a black helmet and a girl wearing a pink helmet are cycling together .,671,"mountain bike, all-terrain bike, off-roader","bicycle,backpack,person,riding,mountain,bike,person,ride,bike,dirt","man,wear,black,helmet,girl,wear,pink,helmet,cycle"
1287073593,"Five sled dogs are pulling a person on a sled , through the snow .",537,"dogsled, dog sled, dog sleigh","person,dog,sled,dog,racing,group,people,stand,snow,dog","sled,dog,pull,person,sled,snow"
1287982439,A dog runs through the water as he looks up at the sky with his mouth open .,209,Chesapeake Bay retriever,"dog,training,dog,brown,dog,stand,water","dog,run,water,look,sky,mouth,open"
1295476404,A smiling woman playing the harp .,594,harp,"person,tie,playing,harp,people,stand,grass,hand","smile,woman,play,harp"
129846884,A young boy pulls a car toy up a hill .,621,"lawn mower, mower","person,pushing,car,man,ride,grass","young,boy,pull,car,toy,hill"
129860826,"Outside a building , a uniformed security guard looks at the camera from behind a fence .",515,"cowboy hat, ten-gallon hat","person,tie,sharpening,knives,man,hat,hat,hat","building,uniformed,security,guard,look,camera,fence"
1303644819,A blond woman with an orange shirt is making music on a stool .,401,"accordion, piano accordion, squeeze box","suitcase,chair,person,playing,accordion,woman,stand,suitcase,build","blond,woman,orange,shirt,make,music,stool"
131090759,This image with chairs is very blurry .,603,"horse cart, horse-cart","car,bicycle,chair,person,weaving,basket,horse,draw,carriage,pull,cart,street","image,chair,blurry"
131254736,Two men are standing beside the train tracks .,820,steam locomotive,"backpack,train,person,dancing,macarena,train,travel,train,track,train","man,stand,train,track"
1316505120,"Four men , two of them with guitars , perform on a stage while several people with their hands in the air watch .",819,stage,"person,surfing,crowd,woman,stand,airport","man,guitar,perform,stage,people,hand,air,watch"
131840964,A boy is standing on a sidewalk with his bike .,880,"unicycle, monocycle","bicycle,truck,chair,person,car,riding,a,bike,man,ride,bike,road","boy,stand,sidewalk,bike"
131890223,A diver underwater having fun with a sea turtle .,983,scuba diver,"kite,person,scuba,diving,people,sit,beach","diver,underwater,have,fun,sea,turtle"
132421833,"One man , cleaning a small office with a portable vacuum cleaner .",882,"vacuum, vacuum cleaner","dining,table,person,shining,shoes,man,suit,tie,stand,door","man,clean,small,office,portable,vacuum,cleaner"
132966111,A lot of people are on the street holding balloons .,645,maypole,"umbrella,sport,ball,kite,person,making,jewelry,group,people,stand,field,kite","lot,people,street,hold,balloon"
1329832826,"People stand on a street corner at dusk , with a pharmacy in the background .",498,"cinema, movie theater, movie theatre, movie house, picture palace","car,person,traffic,light,throwing,axe,large,building,sign","people,stand,street,corner,dusk,pharmacy,background"
133087820,A person is sitting outside of a bookstore and reading .,454,"bookshop, bookstore, bookstall","bench,book,person,handbag,reading,book,man,sit,bench,book","person,sit,bookstore,reading"
133189853,A man with a shaved head is kissing another man on the cheek .,457,"bow tie, bow-tie, bowtie","person,tie,tying,bow,tie,man,black,shirt,tie","man,shave,head,kiss,man,cheek"
133243755,Many kids in white shirts are walking through a neighborhood .,617,"lab coat, laboratory coat","person,playing,trumpet,group,people,stand,tent","kid,white,shirt,walk,neighborhood"
1332815795,A little girl is swinging in a baby swing on the playground .,843,swing,"person,swinging,on,something,small,child,hold","little,girl,swinge,baby,swing,playground"
1335519498,A toddler girl swings in a yellow child 's swing .,843,swing,"person,swinging,on,something,woman,sit","toddler,girl,swing,yellow,child,swing"
133868556,This picture is of a young girl practicing gymnastics in a gym .,416,"balance beam, beam","person,boat,passing,American,football,-in,game-,man,stand,room,luggage","picture,young,girl,practice,gymnastic,gym"
1341787777,"Brown dog on grass , drinking water spray from left side of frame .",211,"vizsla, Hungarian pointer","dog,petting,animal,-not,cat-,brown,dog,stand,grass","brown,dog,grass,drink,water,spray,left,frame"
134206,Baseball players are playing on a field in a stadium filled with people .,981,"ballplayer, baseball player","baseball,glove,person,catching,or,throwing,baseball,baseball,player,stand,field","baseball,player,play,field,stadium,fill,people"
1346051107,A man plays saxophone next to a yellow fire hydrant .,776,"sax, saxophone","fire,hydrant,person,playing,saxophone,man,stand,fire,hydrant","man,play,saxophone,yellow,fire,hydrant"
1346095724,A man with a red and black shirt sells fish .,467,"butcher shop, meat market","knife,person,blowing,glass,man,cut,board,knife,knife","man,red,black,shirt,sell,fish"
1347001782,People strolling casually across a bridge .,839,suspension bridge,"person,passing,American,football,-in,game-,person,ride,street","people,stroll,bridge"
135235570,A man is being thrown a Frisbee in front of a monument and flags .,557,"flagpole, flagstaff","frisbee,person,passing,American,football,-not,in,game-,man,stand,field,kite","man,throw,frisbee,monument,flag"
1352398363,A boy is covered with marker .,842,"swimming trunks, bathing trunks","person,handbag,grooming,dog,man,stand,grass,head","boy,cover,marker"
1352410176,A blond girl is stepping on vertical logs in the sand .,460,"breakwater, groin, groyne, mole, bulwark, seawall, jetty","person,playing,bagpipes,man,stand,beach,umbrella","blond,girl,step,vertical,log,sand"
1354131040,A gut wearing a plaid shirt with a mustache selling fish at a market .,118,"Dungeness crab, Cancer magister","bowl,person,weaving,basket,man,stand,banana","gut,wear,plaid,shirt,mustache,sell,fish,market"
1355450069,A man is climbing up a wall,972,"cliff, drop, drop-off","person,stretching,arm,man,stand,wooden,wall","man,climb,wall"
135911244,Two officers in uniform chatting in a golf cart .,515,"cowboy hat, ten-gallon hat","truck,person,car,swinging,on,something,people,middle,bus","officer,uniform,chat,golf,cart"
135916133,"A man wearing a yellow shirt is riding a large riding lawn mower , which is spraying cut grass behind him ; pine trees are visible in the background .",621,"lawn mower, mower","person,skateboard,mowing,lawn,man,sit,grass,luggage","man,wear,yellow,shirt,ride,large,riding,lawn,mower,spray,cut,grass,pine,tree,visible,background"
1362276354,A girl with animal earmuffs is making big bubbles .,971,bubble,"bottle,person,handbag,high,kick,woman,stand,crowd,people","girl,animal,earmuff,make,big,bubble"
136552115,A man jumping on his bmx with another bmxer watching .,671,"mountain bike, all-terrain bike, off-roader","bicycle,backpack,person,riding,mountain,bike,man,ride,bike,dirt,road","man,jump,bmx,bmxer,watch"
1365896144,A woman in blue and purple clothing playing pool .,736,"pool table, billiard table, snooker table","person,air,drumming,blue,blue,blue,blue,blue,blue,blue,blue,blue,blue,blue,blue,blue,blue,blue,blue,white","woman,blue,purple,clothing,playing,pool"
136644343,A small boy in a horizontal tire swing .,843,swing,"bicycle,motorcycle,person,swinging,on,something,man,hold,head,skateboard","small,boy,horizontal,tire,swing"
136644885,A woman wearing a white shirt and jeans crosses a rope bridge in a wooded area .,839,suspension bridge,"person,climbing,tree,people,stand,fence","woman,wear,white,shirt,jean,cross,rope,bridge,wooded,area"
136679463,A man is performing for a crowd on a tall unicycle .,880,"unicycle, monocycle","person,riding,unicycle,man,ride,bike,build","man,perform,crowd,tall,unicycle"
1370293802,A chef with glasses cooks french bread in a giant oven .,766,rotisserie,"hot,dog,oven,person,refrigerator,sword,fighting,chef,cooking,kitchen,oven","chef,glass,cook,french,bread,giant,oven"
