4953536921,A woman and a dog sit on a bench in front of a beach .,703,park bench,"umbrella,bench,person,dog,jumping,into,pool,man,sit,bench,ocean","woman,dog,sit,bench,beach"
4954417902,A man on a motorbike is resting .,665,moped,"motorcycle,person,handbag,car,backpack,traffic,light,milking,cow,man,ride,motorcycle,street","man,motorbike,rest"
4954827712,Tourists walk among the grounds near a historic site .,698,palace,"person,swinging,on,something,group,people,walk,street,people,background","tourist,walk,ground,historic,site"
4960200748,One man in black is jumping high into the air on his bicycle .,671,"mountain bike, all-terrain bike, off-roader","bicycle,person,riding,mountain,bike,man,ride,bike,dirt","man,black,jump,air,bicycle"
4960260408,A man in blue makes his way through a crowd during a race .,768,rugby ball,"person,handbag,shaking,hands,group,people,play,hand","man,blue,make,way,crowd,race"
4961939249,Crowd gathers near adobe building under cliff .,500,cliff dwelling,"person,handbag,rock,climbing,group,people,stand,stone,wall","crowd,gather,adobe,building"
4963015721,A girl wearing glasses and a multicolored scarf is talking with a guy and laughing .,824,stole,"car,person,tasting,food,woman,hair,hold,phone","girl,wear,glass,multicolore,scarf,talk,guy,laugh"
4963339615,Two girls walking underneath a purple umbrella .,879,umbrella,"truck,bus,person,handbag,car,umbrella,swinging,on,something,woman,umbrella,walk,street","girl,walk,purple,umbrella"
4965314386,"A young blond boy riding a red , white , blue , and yellow bicycle with american flags on it .",870,"tricycle, trike, velocipede","motorcycle,person,traffic,light,changing,wheel,young,boy,ride,bike,air","young,blond,boy,ride,red,white,blue,yellow,bicycle,american,flag"
4966261267,Red firetruck with lights on and a couple of firemen dressed in gear standing near .,555,"fire engine, fire truck","car,truck,person,giving,or,receiving,award,fire,truck,fire,hydrant,light","red,firetruck,light,couple,fireman,dress,gear,stand"
4966268109,A night scene depicting two Seattle Firemen dressed in their uniforms are standing next to a fire engine .,555,"fire engine, fire truck","truck,person,car,drinking,beer,fire,truck,fire,truck,background","night,scene,depict,seattle,fireman,dress,uniform,stand,fire,engine"
4970590451,A man wearing a colorful helmet while on some type of motorcycle or scooter .,518,crash helmet,"car,person,grooming,dog,man,ride,motorcycle","man,wear,colorful,helmet,type,motorcycle,scooter"
4970968773,A woman wearing jeans and a blue shirt is standing outside smoking a cigarette .,608,"jean, blue jean, denim","chair,person,country,line,dancing,woman,stand,bench,build","woman,wear,jean,blue,shirt,stand,smoke,cigarette"
4972166251,A person is skydiving in the sunset using a teal and yellow parachute .,701,"parachute, chute","kite,person,riding,mountain,bike,person,fly,kite,air","person,skydive,sunset,teal,yellow,parachute"
4972294091,A woman on a bike waits the corner of an intersection at a pedestrian crosswalk .,920,"traffic light, traffic signal, stoplight","bicycle,person,traffic,light,car,riding,a,bike,man,ride,bike,street,car","woman,bike,wait,corner,intersection,pedestrian,crosswalk"
4973611817,A police officer writes a ticket for poor parking .,920,"traffic light, traffic signal, stoplight","bus,motorcycle,person,handbag,car,traffic,light,pumping,gas,people,stand,street","police,officer,write,ticket,poor,parking"
497374910,A girl is sleeping on top of a book in a library full of books .,624,library,"chair,person,book,riding,camel,woman,stand,library","girl,sleep,book,library,book"
4973929160,A crowd and two males dressed in different cultural attire playing the drums .,541,"drum, membranophone, tympan","car,chair,person,handbag,playing,volleyball,group,people,sit,wooden,table","crowd,male,dress,different,cultural,attire,play,drum"
497791037,A child in a white shirt coming out of a swing in midair .,843,swing,"person,side,kick,man,sit,bench,park","child,white,shirt,come,swing,midair"
4979134930,A man in a hat and brown shirt rides a bike .,791,shopping cart,"bicycle,chair,person,handbag,umbrella,opening,present,man,woman,stand,cart,cart","man,hat,brown,shirt,ride,bike"
4981165601,A man with an umbrella is standing on a hillside and its raining .,879,umbrella,"umbrella,person,presenting,weather,forecast,woman,hold,umbrella,umbrella","man,umbrella,stand,hillside,raining"
4983598261,"Two men working at an outside grill , cooking meat .",467,"butcher shop, meat market","person,dancing,macarena,man,cut,kitchen","man,work,outside,grill,cook,meat"
4985704,A man on a ten-foot unicycle entertains a crowd of enthralled onlookers .,880,"unicycle, monocycle","person,riding,unicycle,man,ride,bike,build","man,foot,unicycle,entertain,crowd,enthralled,onlooker"
4986921677,An elderly man swims with others .,842,"swimming trunks, bathing trunks","bird,person,jumping,into,pool,people,play,surfboard","elderly,man,swim"
4992006407,A couple of men playing pool .,736,"pool table, billiard table, snooker table","sport,ball,person,bee,keeping,woman,green,grass","couple,man,play,pool"
5004301175,A woman wearing shorts is feeding two llamas or alpacas in a field .,355,llama,"sheep,person,riding,camel,horse,graze,field,tree","woman,wear,short,feed,llama,alpaca,field"
5006080985,"Players 24 , 33 , and 57 , are dressed in white , blue , and yellow jerseys on the football field .",560,football helmet,"person,hurling,-sport-,football,football,football,football,football","player,dress,white,blue,yellow,jersey,football,field"
500678178,A young child is covered in straw except for the head and left arm .,958,hay,"person,jumping,into,pool,small,baby,lay,grass","young,child,cover,straw,head,leave,arm"
5008200231,"A lady wearing a purple dress appears to be amish , she is hooking up a carriage to a brown and white spotted horse .",603,"horse cart, horse-cart","handbag,car,horse,person,riding,or,walking,with,horse,horse,stand,middle,road","lady,wear,purple,dress,appear,amish,hook,carriage,brown,white,spot,horse"
5009047021,A boy with a football runs from the other team .,560,football helmet,"person,passing,American,football,-in,game-,group,people,play,football","boy,football,run,team"
5009687058,"A football player in navy blue , gold , and white pushes another in white and blue out of his teammates way as a referee looks on from a distance .",560,football helmet,"person,hurling,-sport-,man,white,shirt,white","football,player,blue,gold,white,push,white,blue,teammate,way,referee,look,distance"
5012159302,Two men are using two horse to help with farm work .,730,"plow, plough","car,horse,person,riding,elephant,horse,stand,dirt,field","man,horse,help,farm,work"
50154757,A baby exploring the joy of having good company .,910,wooden spoon,"bed,teddy,bear,toothbrush,person,playing,recorder,young,girl,wear,hat,tie","baby,explore,joy,have,good,company"
50162920,A woman is kneeling near lanterns while a little boy plays in the sand .,522,croquet ball,"sport,ball,person,carving,pumpkin,group,people,sit","woman,kneel,lantern,little,boy,play,sand"
501650847,A man holding out a deflated soccer ball to a gray dog .,178,Weimaraner,"sport,ball,person,dog,training,dog,dog,lay,ground","man,hold,deflate,soccer,ball,gray,dog"
501960549,A woman peeks outside a set of archaic wooden doors .,894,"wardrobe, closet, press","person,throwing,axe,man,stand,door,door","woman,peek,set,archaic,wooden,door"
5024991277,A white bearded fellow looks like hes singing into a microphone .,650,"microphone, mike","bicycle,hair,drier,person,playing,basketball,man,wear,microphone,microphone","white,bearded,fellow,look,s,singe,microphone"
5037997306,"Two men are standing in a building with water over flowing from sinks , one man has a plastic bag holding it and the other man holding one , there is are square trays on top of each other one is red and the other is gray .",791,shopping cart,"dining,table,person,boat,clock,drinking,shots,man,stand,build,luggage","man,stand,building,water,flow,sink,man,plastic,bag,hold,man,hold,square,tray,red,gray"
503872649,A bride stands next to a woman with a large basket of flowers .,982,"groom, bridegroom","person,pot,plant,handbag,playing,didgeridoo,woman,sit,wedding,wall","bride,stand,woman,large,basket,flower"
5047832905,A young child in a red shirt and green pants vacuums the floor in front of an oven in a kitchen .,882,"vacuum, vacuum cleaner","bicycle,oven,person,using,segway,old,kitchen,kind,food","young,child,red,shirt,green,pant,vacuum,floor,oven,kitchen"
5049383578,"The goalie , wearing a yellow and black uniform , is holding the soccer ball in front of the goal while a player , wearing a baby blue uniform , runs behind him .",768,rugby ball,"sport,ball,person,shaving,head,man,play,game","goalie,wear,yellow,black,uniform,hold,soccer,ball,goal,player,wear,baby,blue,uniform,run"
505062117,A dog swims in the water with a tennis ball in his mouth .,256,"Newfoundland, Newfoundland dog","apple,dog,grooming,dog,black,white,dog,sit,ground","dog,swim,water,tennis,ball,mouth"
505837388,"A group , dressed in scuba gear , is sitting at the bottom of a pool .",983,scuba diver,"cell,phone,backpack,person,scuba,diving,people,stand,green,green,green","group,dress,gear,sit,pool"
505929313,A black dog runs in the water holding a pink toy in its mouth .,227,kelpie,"dog,grooming,dog,dog,dog,mouth","black,dog,run,water,hold,pink,toy,mouth"
5062544126,A group of people in a conference .,534,"dishwasher, dish washer, dishwashing machine","dining,table,chair,laptop,person,eating,doughnuts,group,people,cut,cake,table","group,people,conference"
506485519,This is couple hiking over some rocks in a park of some sort .,972,"cliff, drop, drop-off","backpack,person,playing,bagpipes,man,stand,rock,wood","couple,hike,rock,park,sort"
506738508,Two men in white suits cheer,617,"lab coat, laboratory coat","cup,bottle,person,tie,drinking,beer,man,white,shirt,tie","man,white,suit,cheer"
506882688,Kids are standing in the sprinklers getting soaked with water .,562,fountain,"person,jumpstyle,dancing,man,black,shirt,spray,water,rain","kid,stand,sprinkler,getting,soak,water"
5071580142,An artist at work with all his supplies around him,865,toyshop,"chair,person,bottle,cup,apple,making,jewelry,man,cut,cake,toy","artist,work,supply"
507370108,Five people wear white clothing with fire designs on them while standing next to fire .,862,torch,"umbrella,person,handbag,riding,a,bike,group,people,stand","people,wear,white,clothing,fire,design,stand,fire"
507370544,A similarly attired group posing for a group photo-op at this event .,862,torch,"person,handbag,catching,fish,group,people,stand,sky","attire,group,pose,group,photo,op,event"
507401473,A tribe of people are posing for a picture .,862,torch,"person,high,kick,group,people,stand,middle,beach","tribe,people,pose,picture"
5075833333,A photographer snaps a midair action shot of a snowboarder .,795,ski,"snowboard,person,playing,trombone,man,black,jacket,ride,snowboard","photographer,snap,midair,action,shoot,snowboarder"
50797765,A man wearing overalls maneuvers a large soap bubble as a crowd of people stands around him .,971,bubble,"kite,person,flying,kite,group,people,stand,build","man,wear,overall,maneuver,large,soap,bubble,crowd,people,stand"
5079930983,Six musicians play their various instruments .,486,"cello, violoncello","bench,person,handbag,playing,cello,woman,red,shirt,white,photo,red,white","musician,play,instrument"
50831436,Several men are playing a board game in a living room .,611,jigsaw puzzle,"handbag,person,backpack,couch,book,garbage,collecting,woman,sit,bed,laptop","man,play,board,game,living,room"
508838116,A woman is standing in a very large produce section of a grocery store .,582,"grocery store, grocery, food market, market","clock,person,pot,plant,bottle,carrot,tv,apple,skiing,crosscountry,market,fill,lot,vegetable,vegetable","woman,stand,large,produce,section,grocery,store"
5091113794,A man with a mustache and a black shirt is playing the saxophone .,776,"sax, saxophone","person,skateboard,playing,saxophone,man,stand,old,building","man,mustache,black,shirt,play,saxophone"
5091152801,"A heavily makeup-ed girl sings into a microphone that she grips with her fire engine red , claw like nails .",650,"microphone, mike","person,surfing,water,woman,hold,hair,hold,hair","makeup,ed,girl,sing,microphone,grip,fire,engine,red,claw,nail"
509200598,Two black dogs are playing on the grass .,205,flat-coated retriever,"dog,training,dog,black,dog,walk,grass,dog","black,dog,play,grass"
5094276864,A Pee Wee league football player wearing a purple jersey navigates the football past opposing players in white jerseys .,560,football helmet,"person,passing,American,football,-in,game-,man,play,football,grass","league,football,player,wear,purple,jersey,navigate,football,oppose,player,jersey"
5094295894,"Three children in football uniforms of two different teams are playing football on a football field , while another player and an adult stand in the background .",560,football helmet,"person,passing,American,football,-in,game-,football,player,hold,football,football","child,football,uniform,different,team,play,football,football,field,player,adult,stand,background"
509985875,A man is holding a saxophone in a public place as a woman and a child walk by in the background .,776,"sax, saxophone","umbrella,person,pot,plant,stop,sign,playing,saxophone,man,stand,sidewalk,cell,phone","man,hold,saxophone,public,place,woman,child,walk,background"
5104136462,Several boys in short and tank tops or t-shirts are running .,768,rugby ball,"person,riding,a,bike,group,people,play,game","boy,short,tank,top,t,shirt,run"
511844627,A man skis on a snowy mountain .,795,ski,"backpack,person,skiing,-not,slalom,or,crosscountry-,skier,go,snow,cover,slope","man,ski,snowy,mountain"
511921542,A young man in a blue shirt with white shorts volleys a tennis ball .,752,"racket, racquet","sport,ball,tennis,racket,person,playing,harp,man,swinge,tennis,racket,tennis,court","young,man,blue,shirt,white,short,volley,tennis,ball"
5121796265,A woman is reading a book on philosophy .,840,"swab, swob, mop","person,playing,basketball,girl,hold,blue,umbrella,blue,blue,blue,blue,blue,blue,blue,blue,blue,blue,blue,blue,blue,blue,blue,blue,blue,blue,blue,blue,blue,blue,blue,blue,blue,blue,blue,blue,blue,blue,blue,blue,blue","woman,read,book,philosophy"
5126656489,2 men are plowing a field together .,730,"plow, plough","person,chopping,wood,man,stand,different,animal","man,plow,field"
5139672263,Teenager rides through the forest on his mountain bike .,671,"mountain bike, all-terrain bike, off-roader","motorcycle,person,playing,accordion,motorcycle,rider,ride,dirt,dirt,road","teenager,ride,forest,mountain,bike"
514222285,A little child is in full ski gear while standing on the snow .,795,ski,"person,ski,ice,skating,man,red,jacket,stand,snow,cover,slope","little,child,ski,gear,stand,snow"
5149869859,A group of young boys play a basketball game .,430,basketball,"person,playing,basketball,group,people,play,game","group,young,boy,play,basketball,game"
5152207388,Disgruntled man eating strange food with chopsticks .,542,drumstick,"person,tying,knot,-not,on,a,tie-,man,hold,toothbrush","disgruntle,man,eat,strange,food,chopstick"
515335111,A man and a dog are in a canoe on the water .,472,canoe,"dog,person,boat,canoeing,or,kayaking,man,boat,boat,water","man,dog,canoe,water"
5163992452,Spectators are watching two women dance .,775,sarong,"person,golf,driving,group,people,stand,street","spectator,watch,woman,dance"
517102724,A black dog in front of a waterfall .,208,Labrador retriever,"dog,walking,the,dog,dog,run,water,dog","black,dog,waterfall"
5181863160,A boy is playing in the ocean waves .,842,"swimming trunks, bathing trunks","person,ice,skating,young,boy,surf,wave","boy,play,ocean,wave"
5192912743,Two children are both reaching for a soccer ball .,805,soccer ball,"sport,ball,person,playing,volleyball,child,play,soccer,ground","child,reach,soccer,ball"
519317202,A baby boy in a car seat is asleep and crying .,785,"seat belt, seatbelt","couch,person,dribbling,basketball,young,boy,blue,shirt,tie","baby,boy,car,seat,asleep,cry"
519386080,Young people with matching hairstyles pose for the camera under a white umbrella .,879,umbrella,"umbrella,person,giving,or,receiving,award,woman,stand,umbrella","young,people,matching,hairstyle,pose,camera,white,umbrella"
521109000,Tom hanks reading a book in the making of castaway .,801,snorkel,"person,swinging,on,something,man,blue,shirt,hold,surfboard","hank,read,book,making,castaway"
521186251,Several girls on a raft floating in rough waters .,693,"paddle, boat paddle","surfboard,person,rock,climbing,man,ride,boat,water","girl,raft,float,rough,water"
5214588693,Two men playing football .,560,football helmet,"baseball,glove,person,passing,American,football,-in,game-,group,people,play,game,soccer","man,play,football"
521658170,Three dogs are jumping up at the man waving a stick .,211,"vizsla, Hungarian pointer","backpack,person,dog,training,dog,man,woman,lay,grass,dog","dog,jump,man,wave,stick"
5222104909,A young girl sitting on a wooden chair .,765,"rocking chair, rocker","bed,person,eating,cake,woman,sit,bench,wooden,bench","young,girl,sit,wooden,chair"
5222250994,One lone skier is making his way down a snowy mountain slope which has many ski track marks visible on the snow pack and a ski lift in the background .,795,ski,"person,ski,skiing,slalom,skier,ski,snowy,slope","lone,skier,make,way,snowy,mountain,slope,ski,track,mark,visible,snow,pack,ski,lift,background"
5223651213,Two young girls are having fun snow sledding down a hill .,795,ski,"person,eating,chips,man,ride,snowboard,snow","young,girl,have,fun,snow,sled,hill"
522652105,A small girl is playing in a ball pit,417,balloon,"apple,shaking,hands,blue,white,photo,person,table","small,girl,play,ball,pit"
5226870137,A driver guides his white horses and carriage down a street .,603,"horse cart, horse-cart","car,horse,person,riding,mule,horse,draw,carriage,pull,carriage,middle,street","driver,guide,white,horse,carriage,street"
523249012,The man in the white shirt is sitting on a rock with a pole in front of him .,758,reel,"chair,person,catching,fish,man,sit,boat,people","man,white,shirt,sit,rock,pole"
5235619020,A basketball player shooting a free throw .,430,basketball,"bench,tennis,racket,chair,person,sport,ball,playing,basketball,group,people,play,game,basketball","basketball,player,shoot,free,throw"
5235783452,A little girl is smiling while holding a vacuum and an older male is holding a large drill .,882,"vacuum, vacuum cleaner","chair,person,pot,plant,suitcase,tv,shaving,head,man,stand,tv","little,girl,smile,hold,vacuum,old,male,hold,large,drill"
5238492471,"An old guitar player without a shirt on is pointing , sweating .",819,stage,"tennis,racket,person,tv,playing,clarinet,guitar,guitar,background","old,guitar,player,shirt,point,sweat"
524036004,Boy in red and blue flowered trunks jumps into pool holding green ball .,842,"swimming trunks, bathing trunks","bench,sport,ball,person,throwing,ball,woman,blue,shirt,white,short,white,short","boy,red,blue,flower,trunk,jump,pool,hold,green,ball"
524296878,A sergeant leads his troops in formation inside a large room with lots of flags in the background .,652,military uniform,"person,snatch,weight,lifting,soldier,military,uniform,pose,picture","sergeant,lead,troop,formation,large,room,lot,flag,background"
5243039066,A woman in a blue ski coat pulls a tree through the snow on skies .,795,ski,"backpack,person,ski,skiing,crosscountry,woman,stand,snow,cover,slope","woman,blue,ski,coat,pull,tree,snow,sky"
5243039266,a boy is pulling a small tree while he skis,795,ski,"backpack,person,ski,skiing,crosscountry,man,stand,ski,snow,cover,slope","boy,pull,small,tree,ski"
524698457,A long-haired dog is jumping over horizontal poles .,226,briard,"dog,grooming,dog,large,brown,dog,sit,wooden,table","long,haired,dog,jump,horizontal,pole"
5247558458,"A group of people headed up an escalator , many of them holding an umbrella .",879,umbrella,"umbrella,person,playing,accordion,woman,umbrella,umbrella","group,people,head,escalator,hold,umbrella"
5248756214,A man taking frames on the road .,627,"limousine, limo","car,motorcycle,person,pushing,car,man,stand,street,umbrella","man,take,frame,road"
5250328927,Several parasailor 's enjoying a windy day out on the water .,701,"parachute, chute","kite,person,pumping,fist,person,fly,kite,air","parasailor,enjoy,windy,day,water"
526661994,A dog runs through the grass .,235,"German shepherd, German shepherd dog, German police dog, alsatian","dog,training,dog,dog,run,air,dog","dog,run,grass"
5270958162,A group of men standing near the road in front of an advertisement and tram car .,829,"streetcar, tram, tramcar, trolley, trolley car","umbrella,person,playing,chess,man,ride,street,people,background","group,man,stand,road,advertisement,tram,car"
5270960438,People walking on a beautiful day in San Francisco .,829,"streetcar, tram, tramcar, trolley, trolley car","train,person,car,backpack,cup,passing,American,football,-in,game-,people,sit,train,track","people,walk,beautiful,day"
5274828176,two kids are shoveling snow and one is sitting next to the pile of snow,792,shovel,"car,person,shoveling,snow,man,ski,snow,cover,slope","kid,shovel,snow,sit,pile,snow"
5280521648,A young man and a young women in white lab coats are reading a biology textbook together and looking at a microscope in a laboratory .,617,"lab coat, laboratory coat","laptop,person,pot,plant,book,planting,trees,chef,work,table,food","young,man,young,woman,white,coat,read,biology,textbook,look,microscope,laboratory"
5283494184,A man blowing leaves in jeans and a jacket .,491,"chain saw, chainsaw","backpack,person,baseball,bat,playing,didgeridoo,man,hold,bat,wood","man,blow,leave,jean,jacket"
5284813529,Two Clydesdales pull a large wagon with a family inside .,603,"horse cart, horse-cart","horse,person,riding,or,walking,with,horse,horse,pull,carriage,street","clydesdale,pull,large,wagon,family"
5293561334,A dark-haired person in a yellow top is seated at what appears to be a grand piano .,579,"grand piano, grand","person,clock,playing,trombone,black,white,dog,sit,table","dark,haired,person,yellow,seat,appear,grand,piano"
530454257,A young boy wearing army gear is picking up a rubber ducky in a market .,865,toyshop,"person,spray,painting,man,child,stand,store","young,boy,wear,army,gear,pick,rubber,ducky,market"
530472459,A young boy in a field of flowers carrying a ball,805,soccer ball,"sport,ball,person,pot,plant,playing,basketball,boy,kick,soccer,ball,grass","young,boy,field,flower,carry,ball"
5312921702,Three individuals climbing up a mountain on skis .,795,ski,"backpack,person,ski,skiing,crosscountry,group,people,ski,hill","individual,climb,mountain,ski"
5312974716,A man in orange snowboarding away from the camera .,795,ski,"backpack,snowboard,person,grooming,dog,person,ski,snow","man,orange,snowboard,camera"
532241548,"A crowd of people , all wearing raincoats with hoods pulled up , listening to a man wearing a red and blue raincoat , with curly brunette hair , speaks .",879,umbrella,"bench,chair,person,handbag,umbrella,dancing,charleston,group,people,stand,umbrella,umbrella","crowd,people,wear,raincoat,hood,pull,listen,man,wear,red,blue,raincoat,curly,brunette,hair,speak"
5337047043,A very young girl is sitting in a grocery cart near a grocery store deli .,791,shopping cart,"bicycle,person,pushing,cart,little,girl,sit,store","young,girl,sit,grocery,cart,grocery,store,deli"
5341921763,A horse pulls a carriage behind him with lots of children in it .,603,"horse cart, horse-cart","horse,potted,plant,person,playing,xylophone,horse,pull,carriage,pull,carriage,street","horse,pull,carriage,lot,child"
534318261,A group of young children watching a firetruck .,555,"fire engine, fire truck","truck,person,garbage,collecting,people,stand,fire,truck","group,young,child,watch,firetruck"
535309053,A campsite with tents and picnic tables .,672,mountain tent,"umbrella,bus,chair,person,chopping,wood,group,people,sit,ground,tent","campsite,tent,picnic,table"
5354259419,person walking through the snow leafless trees in background,795,ski,"backpack,person,finger,snapping,woman,black,jacket,stand,snow","person,walk,snow,leafless,tree,background"
5364849864,"Players from two hockey teams , one in black jerseys and one in white , fight over a puck on an ice rink as a referee and audience look on .",746,"puck, hockey puck","baseball,glove,person,playing,ice,hockey,group,people,play,hand","player,hockey,team,black,jersey,white,fight,puck,ice,rink,referee,audience,look"
536904709,a woman in a red shirt and jeans asleep on a brown couch,831,"studio couch, day bed","couch,person,book,dancing,macarena,couch,red,pillow,red,pillow","woman,red,shirt,jean,asleep,brown,couch"
5369771639,two soccer players in long sleeves,805,soccer ball,"sport,ball,person,kicking,soccer,ball,girl,play,soccer,field","soccer,player,long,sleeve"
5375305047,"Two people in skis , wearing blue jackets , with backpacks are standing in the snow on a mountain near a marker .",795,ski,"backpack,snowboard,person,ski,skiing,-not,slalom,or,crosscountry-,people,stand,snow,cover,slope","people,ski,wear,blue,jacket,backpack,stand,snow,mountain,marker"
537532165,girl hanging upside down on blue monkey bars,602,"horizontal bar, high bar","person,pull,ups,woman,hold,head,board","girl,hang,blue,monkey,bar"
5379229830,"A woman wearing glasses is sitting on a swing , in a playground with a lot of trees .",843,swing,"bench,person,playing,badminton,woman,shirt,hold,phone","woman,wear,glass,sit,swing,playground,lot,tree"
537960889,Three people biking on a path with grass on either side of the path .,880,"unicycle, monocycle","bicycle,cup,person,riding,a,bike,man,ride,bike,bike,street","people,bike,path,grass,path"
