2687075275,Two male toddlers in a twin baby carriage in front of a red firetruck numbered 535 .,555,"fire engine, fire truck","truck,person,catching,or,throwing,frisbee,man,park,truck","male,toddler,twin,baby,carriage,red,firetruck,number"
2688936204,"A cowboy clown wearing a shirt with Tax on it , red suspenders , and a white cowboy hat talks into a wireless microphone .",515,"cowboy hat, ten-gallon hat","person,shaking,hands,man,wear,hat,hat,hat","cowboy,clown,wear,shirt,tax,red,suspender,white,cowboy,hat,talk,wireless,microphone"
2689163361,"The girl is twirling long , colorful streamers .",645,maypole,"kite,person,spinning,poi,young,girl,hold,kite,air","girl,twirl,long,colorful,streamer"
2689358407,a young boy running through a water fountain,842,"swimming trunks, bathing trunks","person,tai,chi,man,bikini,short,play,frisbee","young,boy,run,water,fountain"
2691641332,A young girl with her bike .,870,"tricycle, trike, velocipede","bicycle,person,playing,basketball,little,girl,ride,bike","young,girl,bike"
2691863607,Four young children riding red tricycles,870,"tricycle, trike, velocipede","bicycle,person,playing,didgeridoo,little,boy,ride,tricycle,bike","young,child,ride,red,tricycle"
2694178830,a woman with her feet in the air about to do pole vaulting,733,pole,"tennis,racket,chair,person,handbag,golf,driving,woman,jump,catch,tennis,ball","woman,foot,air,pole,vault"
2694680366,two girls swinging together .,843,swing,"person,baseball,bat,carrying,baby,woman,blue,shirt,white,shirt,woman","girl,swinge"
2695085632,A man whose clothes are covered in paint is writing something down while sitting outside in a busy area .,822,steel drum,"bicycle,person,petting,animal,-not,cat-,man,stand,man,talk,cell,phone","man,clothe,cover,paint,write,sit,busy,area"
2695962887,A dog is performing act at dog show .,226,briard,"chair,person,dog,grooming,dog,dog,lay,ground,dog","dog,perform,act,dog"
2696045361,A baseball player having a catch on the field .,981,"ballplayer, baseball player","baseball,glove,person,hitting,baseball,baseball,player,swinge,bat,baseball","baseball,player,have,catch,field"
2698197294,This dog is running through water on a beach .,232,Border collie,"dog,dancing,macarena,dog,run,water","dog,run,water,beach"
2698614194,The three men leaped in the air in an effort to grab the ball .,768,rugby ball,"frisbee,person,dancing,gangnam,style,group,people,play,frisbee,air","man,leap,air,effort,grab,ball"
2699733386,A black and brown dog is running and splashing in the water .,214,Gordon setter,"dog,grooming,dog,dog,run,water","black,brown,dog,run,splash,water"
269986132,A soccer game is in progress .,805,soccer ball,"sport,ball,person,shooting,goal,-soccer-,group,man,play,soccer,field","soccer,game,progress"
270263570,Two dogs are biting each other in the woods .,172,whippet,"dog,petting,animal,-not,cat-,people,stand,grass,mouth","dog,bite,wood"
2705922148,A man in a respiration mask working .,570,"gasmask, respirator, gas helmet","tennis,racket,person,baseball,bat,skateboard,pull,ups,man,white,shirt,hold,skateboard","man,respiration,mask,work"
2707969386,A small dog jumping an obstacle in a grassy field .,192,"cairn, cairn terrier","dog,petting,animal,-not,cat-,dog,stand,red,dog","small,dog,jump,obstacle,grassy,field"
2708176152,A group of people ride bicycles around a curve on a racetrack .,444,"bicycle-built-for-two, tandem bicycle, tandem","bicycle,person,canoeing,or,kayaking,people,ride,bike,road","group,people,ride,bicycle,curve,racetrack"
2708563035,A man rides a bull in a rodeo .,341,"hog, pig, grunter, squealer, Sus scrofa","person,cow,horse,riding,or,walking,with,horse,horse,pet,horse,fenced","man,ride,bull,rodeo"
2708634088,two brown dogs one with a stick in its mouth,236,"Doberman, Doberman pinscher","frisbee,dog,training,dog,dog,stand,grass","brown,dog,stick,mouth"
270864951,"The blond woman is wearing a black , american flag , tartan cap .",515,"cowboy hat, ten-gallon hat","person,shaking,hands,woman,wear,hat,hat,wear,hat","blond,woman,wear,black,american,flag,cap"
2710281519,A woman sitting in the passenger side of a car is waving .,785,"seat belt, seatbelt","car,chair,person,tie,driving,car,group,people,sit,car,car","woman,sit,passenger,car,wave"
271043166,Man cleaning tables in a restaurant covered in coca-cola chairs and decorations .,762,"restaurant, eating house, eating place, eatery","truck,chair,person,dine,table,car,bottle,chopping,wood,group,people,sit,table,people","man,clean,table,restaurant,cover,cola,chair,decoration"
2711075591,Two people are scuba diving in blue water with lots of bubbles .,983,scuba diver,"motorcycle,person,scuba,diving,","people,diving,blue,water,lot,bubble"
2714220101,A white dog runs on the sand .,203,West Highland white terrier,"dog,tai,chi,white,dog,stand,snow","white,dog,run,sand"
2714674623,"A man with a black shirt that says "" Genetic Freak "" is sleeping on a bus .",785,"seat belt, seatbelt","chair,person,handbag,trimming,or,shaving,beard,man,hold,cell,phone,bus","man,black,shirt,say,genetic,freak,sleep,bus"
2716744948,a shirtless man sitting on a rock by a blue building .,425,barn,"person,catching,or,throwing,softball,sit,grass,dog","shirtless,man,sit,rock,blue,building"
271770120,Two black dogs playing tug-of-war .,205,flat-coated retriever,"sport,ball,dog,training,dog,black,dog,lay,grass","black,dog,play,tug,war"
2719343003,A boy with no shirt is standing in water .,842,"swimming trunks, bathing trunks","person,sharpening,pencil,man,bikini,hold,water","boy,shirt,stand,water"
2720039582,One football player caught a pass while the two players from the opposite team attempt to tag him while he 's on the ground .,560,football helmet,"sport,ball,person,passing,American,football,-in,game-,group,people,play,soccer,field","football,player,catch,pass,player,opposite,team,attempt,tag,ground"
2723250451,Brown-haired man plays tennis in a red shirt and black shorts .,752,"racket, racquet","tennis,racket,person,playing,tennis,man,hold,tennis,racket,tennis,court","brown,haired,man,play,tennis,red,shirt,black,short"
2723477522,Two brown dogs run through the grass together .,225,malinois,"dog,training,dog,dog,run,grass,dog","brown,dog,run,grass"
2724379828,"A black male in a green t-shirt and blue jeans , playing violin while seated in a green chair .",889,"violin, fiddle","suitcase,chair,person,playing,violin,man,hold,suitcase,middle,road","black,male,green,t,shirt,blue,jean,play,violin,seat,green,chair"
2725441885,A baseball player in a uniform with a dark top and light pants is hitting the ball with his bat .,981,"ballplayer, baseball player","baseball,glove,person,baseball,bat,hitting,baseball,baseball,player,swinge,bat,baseball,game","baseball,player,uniform,dark,light,pant,hit,ball,bat"
2725508159,"A child appears to be in a canoe wearing a life jacket on the lake , clear blue water and blue sky .",693,"paddle, boat paddle","person,boat,canoeing,or,kayaking,man,boat,paddle,water","child,appear,canoe,wear,life,jacket,lake,clear,blue,water,blue,sky"
2726180005,A very happy baby in a yellow shirt swinging on swing .,843,swing,"person,baseball,bat,catching,or,throwing,baseball,woman,hold,board,water","happy,baby,yellow,shirt,swinge,swing"
2729147877,A young boy swinging upside down from a bar .,602,"horizontal bar, high bar","person,baseball,bat,high,jump,young,boy,play","young,boy,swinge,bar"
2730938963,Three young boys in blue swimming trunks hold hands and jump into an inground pool .,842,"swimming trunks, bathing trunks","surfboard,person,pot,plant,vase,jumping,into,pool,group,people,stand,grass,hand","young,boy,blue,swimming,trunk,hold,hand,jump,inground,pool"
2731813962,"Five young children are seated on a wooden staircase , surrounded by forest flora .",843,swing,"bench,person,carrying,baby,group,people,sit,bench","young,child,seat,wooden,staircase,surround,forest,flora"
2733659177,"A blond-haired boy wearing a yellow shirt and blue pants is climbing a large , fallen tree limb outdoors in grassy meadow .",96,toucan,"person,climbing,tree,man,stand,wood,wood","blond,haired,boy,wear,yellow,shirt,blue,pant,climb,large,fall,tree,limb,grassy,meadow"
2735822661,A little girl at an aquarium sitting in front of a dolphin tank drinking something .,149,"dugong, Dugong dugon","cup,person,dunking,basketball,woman,sit,chair,cell,phone","little,girl,aquarium,sit,dolphin,tank,drink"
2736169657,An older man is playing a violin very creatively .,819,stage,"chair,person,tie,riding,mountain,bike,woman,white,shirt,white,shirt,woman","old,man,play,violin"
2739331794,A motorcyclist races around a track .,518,crash helmet,"car,motorcycle,person,changing,wheel,person,motorcycle,race,track","motorcyclist,race,track"
2739332078,The blond-haired woman is holding a black umbrella .,785,"seat belt, seatbelt","umbrella,person,fixing,hair,woman,black,shirt,white,umbrella","blond,haired,woman,hold,black,umbrella"
2742801792,Man in board shorts is playing beach volleyball .,890,volleyball,"sport,ball,person,playing,volleyball,man,play,frisbee,beach","man,board,short,play,beach,volleyball"
274313927,A black Labrador retriever in a grassy field returns with a white nubby cylinder in its mouth .,205,flat-coated retriever,"frisbee,dog,brushing,teeth,black,dog,stand,grass","black,labrador,retriever,grassy,field,return,white,cylinder,mouth"
274840168,"People are gathering outside , standing around a fountain that is spraying water upwards .",562,fountain,"backpack,person,handbag,extinguishing,fire,group,people,stand,fountain","people,gather,stand,fountain,spray,water"
2748889888,A toddler being helped out of a pool .,842,"swimming trunks, bathing trunks","surfboard,person,jumping,into,pool,young,boy,ride,edge,water","toddler,help,pool"
2750709242,A person wearing shorts looks down at a anvil on top of a wooden barrel .,666,mortar,"person,playing,bagpipes,man,stand,barrel","person,wear,short,look,anvil,wooden,barrel"
2750741104,"On a grassy lawn , a man ( seen only from the floral shorts-clad hips downward ) stands by as a standing child with shoulder-length hair hands a beach ball to a younger seated child with curly hair ; both children wear t-shirts and shorts .",768,rugby ball,"sport,ball,person,exercising,with,an,exercise,ball,young,boy,play,soccer,ball","grassy,lawn,man,see,floral,short,clothe,hip,stand,stand,child,shoulder,length,hair,hand,beach,ball,young,seat,child,curly,hair,child,wear,t,shirt,short"
2754940943,A man with black glasses plays a black guitar .,420,banjo,"handbag,car,person,skateboard,playing,guitar,man,guitar,guitar","man,black,glass,play,black,guitar"
2755053974,"A young boy pretends to drive the car , with his hand on the horn .",785,"seat belt, seatbelt","frisbee,chair,person,car,driving,car,baby,hold,seat,car","young,boy,pretend,drive,car,hand,horn"
275516348,dog running on two legs,172,whippet,"dog,shaking,hands,dog,lay,ground,head","dog,run,leg"
2755314937,Young blond girl displays a colored tongue .,929,"ice lolly, lolly, lollipop, popsicle","person,sticking,tongue,out,young,girl,hair,sit,grass","young,blond,girl,display,colored,tongue"
2755952680,Someone on a bike is performing an aerial trick while other bikers watch .,671,"mountain bike, all-terrain bike, off-roader","car,bicycle,person,sharpening,pencil,man,ride,bike,bike","bike,perform,aerial,trick,biker,watch"
2757779501,A climber on some rocks .,972,"cliff, drop, drop-off","person,rock,climbing,man,ride,rock","climber,rock"
275858550,A man in a black vest and colorful tie draws the attention of a crowd near an outdoor diner .,457,"bow tie, bow-tie, bowtie","umbrella,handbag,person,tie,dunking,basketball,group,people,stand","man,black,vest,colorful,tie,draw,attention,crowd,outdoor,diner"
2758942112,A boy shining the woman 's shoes as the guy in blue watches while he sweeps the streets .,462,broom,"person,handbag,catching,or,throwing,baseball,group,people,sit,bench","boy,shine,woman,shoe,guy,blue,watch,sweep,street"
2763044275,The black dogs are running in a grassy field,205,flat-coated retriever,"dog,training,dog,man,stand,field","black,dog,run,grassy,field"
2763692131,A man in black shorts plays tennis outside .,752,"racket, racquet","tennis,racket,person,playing,tennis,man,play,tennis,tennis,court","man,black,short,play,tennis"
2764732789,A dog runs in a field of brown grass .,161,"basset, basset hound","dog,petting,animal,-not,cat-,dog,lay,grass","dog,run,field,brown,grass"
276589119,A band is starting to warm up their instruments .,819,stage,"laptop,person,baseball,bat,playing,trombone,group,people,sit,table","band,start,warm,instrument"
2766878404,"a little girl wearing a pink shirt is standing in front of a wrought iron fence , staring at a newspaper stand .",743,"prison, prison house","person,playing,xylophone,woman,stand,wooden,bench","little,girl,wear,pink,shirt,stand,wrought,iron,fence,stare,newspaper,stand"
2771662950,A male baseball player catches a baseball in his mitt .,981,"ballplayer, baseball player","sport,ball,baseball,glove,person,tai,chi,baseball,player,stand,field","male,baseball,player,catch,baseball,mitt"
2771802800,A young boy is playing with a slinky in the street,645,maypole,"person,salsa,dancing,group,people,stand,sidewalk,people","young,boy,play,slinky,street"
2771971891,A person is sailing in the air with a red parachute over grass .,701,"parachute, chute","kite,swimming,butterfly,stroke,person,fly,kite,sky","person,sail,air,red,parachute,grass"
2771980357,A Scottish band marching in a stadium as a crowd looks on .,439,"bearskin, busby, shako","person,baseball,bat,playing,bagpipes,group,people,back,baseball","scottish,band,marching,stadium,crowd,look"
2773136618,A young man in a red uniform kicking a soccer ball .,805,soccer ball,"sport,ball,person,juggling,soccer,ball,boy,play,soccer,field","young,man,red,uniform,kick,soccer,ball"
2773747725,A woman in blue standing in front of a racetrack with a saddled horse .,339,sorrel,"horse,person,riding,or,walking,with,horse,woman,stand,horse","woman,blue,stand,racetrack,saddled,horse"
2774362575,A black dog looks up with his head on a blue carpeted step .,236,"Doberman, Doberman pinscher","couch,dog,grooming,dog,dog,lay,bed","black,dog,look,head,blue,carpet,step"
2774576003,Men and women riding bicycles in a hot sunny day in a big city .,880,"unicycle, monocycle","umbrella,bicycle,person,handbag,making,jewelry,group,people,ride,street","man,woman,ride,bicycle,hot,sunny,day,big,city"
2777021428,Little boy on swing,843,swing,"person,skateboard,swinging,on,something,man,hold,board,water","little,boy,swing"
277928620,Lady sitting at the piano .,687,"organ, pipe organ","tv,chair,person,book,playing,organ,old,photo,old,fashioned,table,sort","sit,piano"
278007543,A dog running along the beach .,172,whippet,"dog,clay,pottery,making,dog,lay,beach,head","dog,run,beach"
2780390703,Man standing on a tricycle riding in front of a crowd .,880,"unicycle, monocycle","person,baseball,bat,riding,unicycle,man,trick,skateboard","man,stand,tricycle,ride,crowd"
2781699063,young girl and man standing in front of water fountain .,562,fountain,"person,driving,car,man,ride,water,fountain","young,girl,man,stand,water,fountain"
2782433864,"Three small dogs , two of which are sniffing noses .",151,Chihuahua,"dog,walking,the,dog,dog,stand,grass,dog","small,dog,sniff,nose"
2782480767,A little girl is swimming under the crystal blue water .,801,snorkel,"person,salsa,dancing,woman,blue,shirt,blue,shirt,blue,shirt","little,girl,swim,crystal,blue,water"
2783620390,A motorcyclist is going a very high speeds .,518,crash helmet,"motorcycle,person,tasting,food,man,ride,motorcycle,street","motorcyclist,go,high,speed"
278368851,A person with a shoulder bag reads in the subway station .,877,turnstile,"bench,clock,person,handbag,train,reading,book,woman,walk,subway,station,subway","person,shoulder,bag,read,subway,station"
2785408815,"A doctor is wearing a t-shirt saying "" smile "" under his lab coat upon smiling .",617,"lab coat, laboratory coat","person,playing,basketball,man,white,shirt,white,shirt,white,shirt","doctor,wear,t,shirt,say,smile,lab,coat,smile"
2786219341,There is a man dressed in black walking past the subway as people are getting off .,399,abaya,"train,person,canoeing,or,kayaking,man,stand,truck,open","man,dress,black,walking,subway,people,get"
2786242106,A boy playing on an arrangement of stones .,646,"maze, labyrinth","person,playing,ice,hockey,child,stand,middle,middle,day","boy,play,arrangement,stone"
2789238858,A muzzled greyhound dog is running around a track .,172,whippet,"dog,swinging,legs,giraffe,stand,grass","muzzled,greyhound,dog,run,track"
279153587,A crying baby is lying on a towel .,529,"diaper, nappy, napkin","bed,cup,person,tv,cooking,chicken,woman,hold,baby,wrap,bed","cry,baby,lie,towel"
2791640741,Two men standing next to a fire at night .,862,torch,"car,person,walking,the,dog,old,fire,hydrant,sit,ground","man,stand,fire,night"
2797188545,Two people paddle a canoe down a rough stretch of river near a pine forest .,472,canoe,"person,boat,canoeing,or,kayaking,group,people,water,water","people,paddle,canoe,rough,stretch,river,pine,forest"
2797774642,Children of opposing teams playing a game of soccer,805,soccer ball,"sport,ball,person,kicking,soccer,ball,kid,play,soccer,field","child,oppose,team,play,game,soccer"
280007961,A woman texts on her phone while surrounded by umbrellas .,879,umbrella,"umbrella,person,flying,kite,woman,hold,umbrella,hold,umbrella","woman,text,phone,surround,umbrella"
2800531753,A white person in black pants is looking at the scenery around them .,970,alp,"backpack,person,throwing,axe,man,stand,middle,mountain","white,person,black,pant,look,scenery"
2802464569,A street vendor tending to bagels in food cart .,612,"jinrikisha, ricksha, rickshaw","umbrella,car,chair,person,chopping,wood,man,sit,chair,umbrella","street,vendor,tend,bagel,food,cart"
2802479441,A balding man using his cellphone stands in front of ornate rugs hanging from a wall .,741,"prayer rug, prayer mat","person,wrapping,present,man,stand,old,building","bald,man,cellphone,stand,ornate,rug,hang,wall"
2802497633,A young man riding in a pedicycle .,612,"jinrikisha, ricksha, rickshaw","bicycle,person,pushing,wheelchair,woman,sit,bike,bike","young,man,ride,pedicycle"
2803058589,Boy with red shorts getting soaked with water .,842,"swimming trunks, bathing trunks","person,belly,dancing,man,stand,beach,surfboard","boy,red,short,getting,soak,water"
2805822564,"Child yelling and walking across sand , another figure and ocean in background .",977,"sandbar, sand bar","person,fixing,hair,young,girl,play,frisbee,beach","child,yell,walk,sand,figure,ocean,background"
2806006698,Man spiking volleyball over net with other player in front of him .,890,volleyball,"sport,ball,person,playing,volleyball,group,people,play,soccer,beach","man,spike,volleyball,net,player"
280608840,"There a four men setting in chairs , with music stands in front of them , performing in a quartet , with a cello and three violins , and they are all connected to one speaker .",486,"cello, violoncello","chair,person,baseball,bat,playing,cello,woman,sit,stage,guitar","man,set,chair,music,stand,perform,quartet,cello,violin,connect,speaker"
2807437579,A bride being kissed by a man .,982,"groom, bridegroom","person,tie,finger,snapping,man,woman,formal,attire,tie","bride,kiss,man"
2807437977,A wedding ceremony in a church .,982,"groom, bridegroom","person,rock,climbing,group,people,stand,table,people","wedding,ceremony,church"
2809793070,three dogs playing on a beach,205,flat-coated retriever,"dog,shaking,hands,black,dog,stand,water","dog,play,beach"
2810456728,A band performs on stage under a blue light .,819,stage,"suitcase,person,handbag,dancing,charleston,group,people,sit,stage,laptop","band,perform,stage,blue,light"
281271503,A man in a bright yellow shirt juggles while riding a unicycle .,880,"unicycle, monocycle","person,baseball,bat,juggling,fire,man,white,shirt,jump,skateboard","man,bright,yellow,shirt,juggle,ride,unicycle"
2813588204,Two dogs wearing racing equipment are running on muddy ground .,676,muzzle,"horse,dog,dancing,ballet,brown,dog,stand,grass","dog,wear,racing,equipment,run,muddy,ground"
2815745115,Woman with stuffed animal display .,865,toyshop,"teddy,bear,person,reading,book,woman,stand","woman,stuff,animal,display"
2817230861,Two women play volleyball on the sand .,890,volleyball,"person,playing,volleyball,woman,stand,beach,tennis,racket","woman,play,volleyball,sand"
2820063211,A lady in swimwear playing volleyball at the beach .,890,volleyball,"sport,ball,person,triple,jump,woman,play,volleyball,beach","lady,swimwear,playing,volleyball,beach"
2822156510,A man in an orange safety vest is addressing several other men in a forest .,491,"chain saw, chainsaw","person,disc,golfing,group,people,stand","man,safety,vest,address,man,forest"
2822418176,A man is using a chainsaw to carve a wooden sculpture .,491,"chain saw, chainsaw","person,chopping,wood,man,sit,ground,fire,hydrant","man,chainsaw,carve,wooden,sculpture"
2822891602,The boy in red goggles swims underwater .,801,snorkel,"person,shaking,hands,man,lay,beach,surfboard","boy,red,goggle,swim,underwater"
2823056477,A little boy is wearing a blue helmet riding his scooter on the sidewalk .,870,"tricycle, trike, velocipede","car,person,skateboard,riding,scooter,little,child,ride,tricycle,tricycle","little,boy,wear,blue,helmet,ride,scooter,sidewalk"
2824875517,A man reading and evaluating the nation 's stocks .,918,"crossword puzzle, crossword","person,book,reading,newspaper,person,hold,book,table,book","man,read,evaluate,nation,stock"
2826701936,Children are playing in a puddle of water that has resulted from a spray gushing from the pavement .,562,fountain,"person,tai,chi,group,people,stand,water","child,play,puddle,water,result,spray,gush,pavement"
2826769554,A brown dog is carrying a wet stick on the shore of the ocean .,207,golden retriever,"dog,riding,camel,dog,lay,ground,mouth","brown,dog,carry,wet,stick,shore,ocean"
2831217847,A blue SUV driving over a small creek .,609,"jeep, landrover","car,truck,person,pushing,car,old,truck,park,water","blue,suv,drive,small,creek"
2831313661,A man wearing jean is flying a kite near the shore .,929,"ice lolly, lolly, lollipop, popsicle","person,eating,ice,cream,man,hold,water","man,wear,fly,kite,shore"
2832076014,"An automobile is submerged in water , almost to the door handles .",609,"jeep, landrover","truck,crossing,river,truck,drive,road,water","automobile,submerge,water,door,handle"
283428775,A dog catching a toy in a field,205,flat-coated retriever,"dog,shaking,hands,black,dog,stand,grass,mouth","dog,catch,toy,field"
2836553263,A boy stopped on his bike on a bike trail as a woman passes by,671,"mountain bike, all-terrain bike, off-roader","bicycle,person,riding,a,bike,man,ride,bike,road","boy,stop,bike,bike,trail,woman,pass"
2837253011,A bald man in a red shirt performs in front of a crowd .,819,stage,"person,canoeing,or,kayaking,group,people,gather,group,people","bald,man,red,shirt,perform,crowd"
2837740149,Two toddlers are sharing a swing .,843,swing,"person,baseball,bat,playing,basketball,people,stand,street","toddler,share,swing"
2837799692,A football player has the number 25 .,560,football helmet,"person,hurling,-sport-,baseball,player,hold,bat,background","football,player,number"
2837804631,A child being splashed by a water fountain .,562,fountain,"bench,car,bus,person,setting,table,young,boy,skateboard,water","child,splash,water,fountain"
2838085973,A man wearing a white uniform is playing football .,560,football helmet,"baseball,glove,person,passing,American,football,-in,game-,football,player,wear,football,gear,ground","man,wear,white,uniform,play,football"
2839397766,A birthday party is going on with lots of people celebrating .,762,"restaurant, eating house, eating place, eatery","dining,table,chair,bottle,person,playing,ice,hockey,woman,sit,table,wine","birthday,party,go,lot,people,celebrate"
2839789830,A black and white dog catches a Frisbee on a grassy field .,232,Border collie,"frisbee,person,dog,shaking,hands,dog,run,catch,frisbee","black,white,dog,catch,frisbee,grassy,field"
284279868,Two long-haired dogs play in the snow .,205,flat-coated retriever,"dog,shaking,hands,dog,water,mouth","long,haired,dog,play,snow"
2842849030,A child plays in a pool while wearing orange floaties .,433,"bathing cap, swimming cap","person,water,sliding,young,girl,pink,shirt,swim,water","child,play,pool,wear,orange,floatie"
2844963839,A group of football players wearing orange and blue uniforms gather together on the field .,560,football helmet,"person,kicking,field,goal,football,player,football,football","group,football,player,wear,orange,blue,uniform,gather,field"
2845913086,People are playing volleyball at the beach .,890,volleyball,"bench,sport,ball,person,drop,kicking,group,people,play","people,play,volleyball,beach"
2845914142,A volleyball player at the 2008 beijing olympics .,890,volleyball,"person,swimming,backstroke,man,stand,beach,hold,kite","volleyball,player"
2847859796,A child in colorful goggles plays in a pool .,801,snorkel,"person,playing,didgeridoo,woman,blue,shirt,blue,hat,dog","child,colorful,goggle,play,pool"
2848266893,The man is wearing a white suit and walking on the street .,480,"cash machine, cash dispenser, automated teller machine, automatic teller machine, automated teller, automatic teller, ATM","person,tai,chi,man,white,shirt,white,shirt,tie","man,wear,white,suit,walk,street"
2848418175,"A man wearing black with a gray hat , holding a pitchfork , directs a horse-drawn cart .",730,"plow, plough","person,horse,riding,or,walking,with,horse,horse,stand,dirt,field","man,wear,black,gray,hat,hold,pitchfork,direct,horse,draw,cart"
2849842834,Ladies talking in an airport .,614,kimono,"backpack,person,handbag,playing,accordion,group,people,stand,build","lady,talk,airport"
