3546474710,"The gutarist upfront is under a spotlight , and the drummer in the back is under one too .",819,stage,"person,playing,harp,man,white,shirt,hold,skateboard","gutarist,spotlight,drummer"
3547600292,A black bird with a yellow beak standing in green grass .,15,"robin, American robin, Turdus migratorius","bird,feeding,birds,bird,sit,green,grass","black,bird,yellow,beak,stand,green,grass"
3549208986,A little girl with a pink headband is blowing a bubble through her fingers .,971,bubble,"bowl,chair,person,playing,accordion,people,hold,head,hand","little,girl,pink,headband,blow,bubble,finger"
3549583146,The boy with the red and blue helmet rides his bicycle .,870,"tricycle, trike, velocipede","bench,bicycle,person,riding,a,bike,young,boy,ride,bike,helmet","boy,red,blue,helmet,ride,bicycle"
3551281733,A closeup of a hummingbird flying .,94,hummingbird,"bird,feeding,birds,fly,grass","closeup,hummingbird,fly"
3551787566,Woman in blue workout attire and helmet rides through dirt path,671,"mountain bike, all-terrain bike, off-roader","bicycle,person,riding,mountain,bike,man,ride,bike,dirt,track","woman,blue,workout,attire,helmet,ride,dirt,path"
355444658,A man wearing a hat and holding a gun is kneeling in a field next to a brown dog .,209,Chesapeake Bay retriever,"person,dog,handbag,news,anchoring,man,hold,dog,middle,camera","man,wear,hat,hold,gun,kneel,field,brown,dog"
3555086376,"Two young children , one in an inflatable life vest , swim in a pool .",433,"bathing cap, swimming cap","surfboard,person,dancing,ballet,man,red,shirt,white,shirt,woman,water","young,child,inflatable,life,vest,swim,pool"
3555376013,a woman is rounding a corner in a roller derby .,615,knee pad,"person,skateboard,roller,skating,man,black,shirt,jump,kick,ball","woman,round,corner,roller,derby"
3556181622,A woman with a red helmet is skating .,615,knee pad,"person,running,on,treadmill,man,ride,air","woman,red,helmet,skate"
3558796959,a woman in a white shirt is playing tennis,752,"racket, racquet","sport,ball,tennis,racket,person,playing,tennis,man,hold,tennis,racket,tennis,court","woman,white,shirt,play,tennis"
3559429170,A woman doing a jump on a bike,671,"mountain bike, all-terrain bike, off-roader","bicycle,person,riding,a,bike,man,ride,bike,dirt,track","woman,jump,bike"
3559993787,Person on bike in air above two large boulders with sun overhead .,671,"mountain bike, all-terrain bike, off-roader","bicycle,person,riding,a,bike,bike,ride,bike,air","person,bike,air,large,boulder,sun"
3560620846,A guy in a black shirt climbing rocks near water .,972,"cliff, drop, drop-off","person,sticking,tongue,out,man,ride,ground,water","guy,black,shirt,climb,rock,water"
3561537309,A boy in blue shorts standing in the surf .,842,"swimming trunks, bathing trunks","person,punching,person,-boxing-,man,stand,beach,surfboard","boy,blue,short,stand,surf"
3561578941,A man with a yellow shirt and blue shorts is walking off of a soccer field .,805,soccer ball,"baseball,glove,person,shaking,hands,baseball,player,stand,field","man,yellow,shirt,blue,short,walk,soccer,field"
3561639055,A person on a red bike .,671,"mountain bike, all-terrain bike, off-roader","bicycle,person,brushing,teeth,man,ride,bike,road","person,red,bike"
3562169000,A blue race car slides off of the track with its back tires .,751,"racer, race car, racing car","car,pumping,fist,old,car,park,road","blue,race,car,slide,track,tire"
3563229764,A man plays guitar for a woman and child .,641,maraca,"sport,ball,person,handbag,dancing,ballet,people,sit,bench,arm","man,play,guitar,woman,child"
3563668905,A biker wearing a helmet .,671,"mountain bike, all-terrain bike, off-roader","bicycle,person,riding,mountain,bike,man,ride,bike,dirt,track","biker,wear,helmet"
3563871276,A person stands on a boat in the ocean .,484,catamaran,"surfboard,kite,person,boat,brushing,teeth,man,hold,surfboard,ocean","person,stand,boat,ocean"
3564148252,A yellow motorcycle and rider take a turn .,518,crash helmet,"motorcycle,person,golf,driving,police,officer,race,track,track","yellow,motorcycle,rider,turn"
3564742915,Two mountain climbers walk through a pass with snowy mountains behind them .,970,alp,"backpack,person,rock,climbing,group,people,stand,mountain","mountain,climber,walk,pass,snowy,mountain"
356478206,A celebratory girl wearing pink at a bowling alley .,416,"balance beam, beam","person,riding,unicycle,woman,stand,skateboard","celebratory,girl,wear,bowling,alley"
356566832,A man pulling his cart full of brooms .,612,"jinrikisha, ricksha, rickshaw","bicycle,person,shaking,hands,man,ride,bike,street,bicycle","man,pull,cart,broom"
3567061016,A bird with its wings spread,21,kite,"bird,person,brush,painting,bird,sit,ground","bird,wing,spread"
3567358622,Two women wearing helmets and safety pads appear to be fighting .,615,knee pad,"person,shaking,hands,man,play,soccer,soccer,field","woman,wear,helmet,safety,pad,appear,fight"
3567604049,A man is about to do a belly-smacker into the pool .,842,"swimming trunks, bathing trunks","chair,person,throwing,discus,man,stand,surfboard,water","man,belly,smacker,pool"
356793404,The diver poses next to a beautiful underwater plant .,983,scuba diver,"person,ski,scuba,diving,","diver,pose,beautiful,underwater,plant"
3568225554,A person in a red shirt is holding on to a natural formation .,972,"cliff, drop, drop-off","person,rock,climbing,person,fly,air,ground","person,red,shirt,hold,natural,formation"
3568918598,two people in stilts wearing fur walking down the road,568,fur coat,"car,dog,playing,bagpipes,man,walk,sidewalk,skateboard","people,stilt,wear,fur,walk,road"
3569126684,A young boxer dog races across a green lawn .,242,boxer,"dog,swinging,on,something,dog,lay,grass,dog","young,boxer,dog,race,green,lawn"
3571039224,A dog with black fur has put its head underwater .,256,"Newfoundland, Newfoundland dog","bear,tai,chi,dog,run,water,dog","dog,black,fur,head,underwater"
3572872724,A soldier taking his German shepherd for a walk .,235,"German shepherd, German shepherd dog, German police dog, alsatian","person,dog,walking,the,dog,man,hold,frisbee,grass","soldier,take,german,shepherd,walk"
3574522127,A baseman catches a baseball while a runner slides to touch the base during a game of baseball .,981,"ballplayer, baseball player","sport,ball,baseball,glove,person,hitting,baseball,baseball,player,stand,field","baseman,catch,baseball,runner,slide,touch,base,game,baseball"
3575330012,An outfielder for the Boston Red Sox catches a pop fly during a day baseball game .,981,"ballplayer, baseball player","baseball,glove,person,catching,or,throwing,baseball,baseball,player,stand,field,baseball,bat","outfielder,catch,pop,fly,day,baseball,game"
3580375310,A boy plays soccer in a field near an apartment building .,805,soccer ball,"sport,ball,person,shooting,goal,-soccer-,young,boy,play,soccer,field","boy,play,soccer,field,apartment,building"
3582920844,A person in the water .,562,fountain,"person,spinning,poi,person,surf,water,water","person,water"
3583105294,"During a concert , a man is standing on a stage looking down at the crowd .",819,stage,"person,skateboard,surfing,crowd,crowd,people,stand,airport","concert,man,stand,stage,look,crowd"
3583710170,"Elderly couples , as well as various people of other ages dancing at a celebration with lights in the background .",982,"groom, bridegroom","person,tie,giving,or,receiving,award,group,people,stand","elderly,couple,people,age,dance,celebration,light,background"
3583903436,A young boy swings along side an old wooden building .,843,swing,"person,handbag,cleaning,gutters,man,sit,bench,foot","young,boy,swing,old,wooden,building"
3584406900,A group of children are playing on swings .,843,swing,"car,person,parking,meter,throwing,axe,man,hold,beach","group,child,play,swing"
3584534971,A man leads the way on his bike while two others follow in the distance .,671,"mountain bike, all-terrain bike, off-roader","bicycle,person,riding,mountain,bike,man,ride,bike,dirt,road","man,lead,way,bike,follow,distance"
3584561689,A group of boys play basketball together .,430,basketball,"sport,ball,person,playing,basketball,man,hold,frisbee,air","group,boy,play,basketball"
358770558,A young male is sitting on a bench next to a wooden door .,523,crutch,"bench,person,giving,or,receiving,award,woman,sit,bench,build","young,male,sit,bench,wooden,door"
3587781729,Two kids enjoy a tire swing .,843,swing,"bench,motorcycle,person,car,swinging,on,something,man,hold,handle,water","kid,enjoy,tire,swing"
3587847246,A professional baseball player swings his bat in an attempt to hit an oncoming baseball .,981,"ballplayer, baseball player","chair,person,sport,ball,baseball,glove,baseball,bat,hitting,baseball,baseball,player,swinge,ball","professional,baseball,player,swing,bat,attempt,hit,oncoming,baseball"
3588417747,A skateboarder slides down a stair rail in the dark .,421,"bannister, banister, balustrade, balusters, handrail","person,skateboard,blowing,out,candles,person,skateboard,rail,rail","skateboard,slide,stair,rail,dark"
358875403,A duck flaps its wings near the water .,99,goose,"bird,dancing,macarena,duck,stand,water","duck,flap,wing,water"
3589367895,The man dressed liked an indian wearing feathers is standing in front of the microphone .,699,"panpipe, pandean pipe, syrinx","person,skiing,-not,slalom,or,crosscountry-,man,umbrella,woman,walk,street","man,dress,like,indian,wear,feather,stand,microphone"
3591283677,"There is a little boy ready to hit the tennis ball , holding a racquet .",752,"racket, racquet","tennis,racket,person,catching,or,throwing,softball,man,hold,tennis,racket,tennis,court","little,boy,ready,hit,tennis,ball,hold,racquet"
3591460077,A female is getting her hair curled with a hair iron .,585,hair spray,"cell,phone,person,getting,a,haircut,woman,hair,hair,hair","female,get,hair,curl,hair,iron"
3593538248,A group of hockey players and one official stand on the ice during a game .,746,"puck, hockey puck","person,ski,playing,ice,hockey,group,people,stand,snow,people","group,hockey,player,official,stand,ice,game"
3593666715,Here is a woman holding out a paddle in a novelty shop with everything .,865,toyshop,"frisbee,person,brush,painting,man,stand,store","woman,hold,paddle,novelty,shop"
3594029059,A bird flies through the air with wings extended .,22,"bald eagle, American eagle, Haliaeetus leucocephalus","bird,brush,painting,large,bird,stand,grass","bird,fly,air,wing,extend"
3595992258,A brown dog runs in the woods with a serious look on its face .,211,"vizsla, Hungarian pointer","dog,drinking,beer,brown,dog,stand,grass","brown,dog,run,wood,look,face"
3596131692,Three children wearing soccer uniforms chase after a blue and gray soccer ball .,805,soccer ball,"sport,ball,person,car,petting,animal,-not,cat-,group,people,play,soccer,field","child,wear,soccer,uniform,chase,blue,gray,soccer,ball"
3596356507,A very ripped girl holds a large barbell on her shoulder in a gym .,422,barbell,"person,clean,and,jerk,woman,stand,outdoor,area","rip,girl,hold,large,barbell,shoulder,gym"
3596459539,A man on a motorcycle is racing at a track .,518,crash helmet,"motorcycle,person,golf,driving,person,ride,motorcycle,road","man,motorcycle,race,track"
3598447435,One man in a green kayak paddling through the water .,693,"paddle, boat paddle","surfboard,person,canoeing,or,kayaking,man,wetsuit,riding,surfboard","man,green,kayak,paddle,water"
3600525829,A parent and child sitting together .,929,"ice lolly, lolly, lollipop, popsicle","bed,person,toothbrush,banana,bottle,eating,ice,cream,child,sit,bench,toothbrush","parent,child,sit"
3601491447,A group of young men in sports uniforms from two opposing teams are in vigorous play on a grassy field .,768,rugby ball,"baseball,glove,person,kicking,soccer,ball,group,people,play,game","group,young,man,sport,uniform,oppose,team,vigorous,play,grassy,field"
3602838407,a small black dog in the ocean with some rocks in the background,205,flat-coated retriever,"dog,training,dog,dog,stand,water,mouth","small,black,dog,ocean,rock,background"
3603064161,Child taking a picture while sister leans on the wall .,872,tripod,"chair,person,playing,saxophone,camera,sit,floor,camera","child,take,picture,sister,lean,wall"
3603116579,The baseball player is running after the ball .,429,baseball,"sport,ball,baseball,glove,person,hitting,baseball,baseball,player,hold,bat,field","baseball,player,run,ball"
3603870481,A black dog is holding an orange toy in its mouth in the water .,256,"Newfoundland, Newfoundland dog","carrot,dog,catching,or,throwing,frisbee,dog,sit,water,dog","black,dog,hold,orange,toy,mouth,water"
3604496023,Person in blue stand by flowers in open air market while another person with a cane walks the path,582,"grocery store, grocery, food market, market","person,pot,plant,handbag,car,banana,backpack,ice,climbing,market,market,lot,people,display","person,blue,stand,flower,open,air,market,person,cane,walk,path"
3606093421,Two men ride an orange raft to shore .,625,lifeboat,"person,boat,driving,car,people,water,yellow,white,boat","man,ride,orange,raft,shore"
3606942887,A swimmer doing the breaststroke in a pool .,433,"bathing cap, swimming cap","person,dancing,gangnam,style,man,blue,shirt,hold,blue,hat","swimmer,breaststroke,pool"
3608585041,Person is parachuting while the sun is setting in background .,701,"parachute, chute","kite,person,weaving,basket,person,fly,kite,sky","person,parachute,sun,set,background"
3608663656,A man rock climbing at the ocean .,972,"cliff, drop, drop-off","person,rock,climbing,people,water,beach","man,rock,climb,ocean"
3608849440,Kids are playing a game of ball outdoors .,981,"ballplayer, baseball player","sport,ball,car,person,catching,or,throwing,baseball,group,people,play,game","kid,play,game,ball"
3609233201,A young boy throws a basketball on a basketball court .,752,"racket, racquet","sport,ball,tennis,racket,person,playing,basketball,man,hold,tennis,racquet,tennis,court","young,boy,throw,basketball,basketball,court"
3609663465,A man in the distance filling a wheel barrel .,428,"barrow, garden cart, lawn cart, wheelbarrow","person,catching,fish,old,truck,park,dirt","man,distance,fill,wheel,barrel"
3610051443,Women selling produce on the side of a busy street .,582,"grocery store, grocery, food market, market","bus,clock,handbag,person,broccoli,riding,mountain,bike,group,people,sit,table,people","woman,sell,produce,busy,street"
3611672054,A shirtless man in colorful shorts spikes a volleyball during a beach volleyball game .,842,"swimming trunks, bathing trunks","sport,ball,person,playing,volleyball,woman,play,volleyball,beach","shirtless,man,colorful,short,spike,volleyball,beach,volleyball,game"
3612485611,Two men dressed in street clothes horse around in front of a building .,522,croquet ball,"person,cleaning,gutters,man,stand,tennis,court","man,dress,street,clothe,horse,building"
3613005134,A wrestler is jumping off of the ring to hit his competitor .,842,"swimming trunks, bathing trunks","person,doing,aerobics,man,black,shirt,woman,stand,grass","wrestler,jump,ring,hit,competitor"
3613375729,A motorcycle racer in a soft turn on an HP branded motorcycle .,518,crash helmet,"motorcycle,person,brushing,teeth,motorcycle,park,road","motorcycle,racer,soft,turn,brand,motorcycle"
3613734337,An official in a blue jacket sits on the sidelines of a tennis match .,752,"racket, racquet","chair,person,tai,chi,man,stand,tennis,court,hold,tennis,racquet","official,blue,jacket,sit,sideline,tennis,match"
36147990,A man wearing a black shirt leans over a pool table to take a shot .,736,"pool table, billiard table, snooker table","sport,ball,person,news,anchoring,woman,play,green,green","man,wear,black,shirt,lean,pool,table,shot"
3615730936,A BMX biker riding down a muddy trail wearing protective gear .,671,"mountain bike, all-terrain bike, off-roader","bicycle,person,riding,mountain,bike,man,ride,bike,dirt,track","bmx,biker,ride,muddy,trail,wear,protective,gear"
3618115051,A couple posing in wigs,903,wig,"person,skipping,rope,man,red,hair,red,hair","couple,posing,wig"
3620778701,A man is leading an ox pulling a cart through a rain forest .,346,"water buffalo, water ox, Asiatic buffalo, Bubalus bubalis","boat,person,cow,riding,elephant,old,elephant,stand,grass","man,lead,ox,pull,cart,rain,forest"
362143915,A man with brown hair hanging in his face stands over a grill as he is cooking meat .,544,Dutch oven,"car,person,cooking,on,campfire,man,stand,man,woman","man,brown,hair,hang,face,stand,grill,cook,meat"
3623650392,A brown dog in a field .,211,"vizsla, Hungarian pointer","dog,balloon,blowing,brown,dog,lay,beach","brown,dog,field"
3624168175,A gray-haired man wearing an orange shirt and blue shirts tending to a garden .,792,shovel,"person,playing,ice,hockey,man,stand,sidewalk,skateboard","gray,haired,man,wear,orange,shirt,blue,shirt,tend,garden"
3628059004,A woman is laughing while playing guitar .,650,"microphone, mike","chair,person,playing,trumpet,woman,stand","woman,laugh,play,guitar"
3628184570,"Two children , one boy and one girl , walking down a paved road holding a black umbrella .",879,umbrella,"umbrella,person,shaking,hands,people,stand,rain,hold,umbrella","child,boy,girl,walk,paved,road,hold,black,umbrella"
3628698119,A black dog is jumping up on its back legs while standing on the grass .,205,flat-coated retriever,"pot,plant,dog,training,dog,black,dog,stand,grass","black,dog,jump,leg,stand,grass"
3631023049,Three smiling children swing in a tire swing at a playground .,843,swing,"bench,person,car,swinging,on,something,man,jump,air,ride","smile,child,swing,tire,swing,playground"
3634754655,A bulldozer on a beach with no water .,977,"sandbar, sand bar","person,playing,didgeridoo,group,people,stand,beach","bulldozer,beach,water"
3635991166,Four boys kneeling next to each other with a ball in front of them .,805,soccer ball,"sport,ball,person,car,jumping,into,pool,man,play,tennis,ball","boy,kneel,ball"
3636055584,Three men participating in a competitive field hockey game .,805,soccer ball,"sport,ball,tennis,racket,person,baseball,bat,playing,kickball,man,play,game","man,participate,competitive,field,hockey,game"
3636247381,A child is throwing a baseball into a net .,429,baseball,"sport,ball,baseball,glove,person,trimming,or,shaving,beard,person,hold,air","child,throw,baseball,net"
3636418958,A gymnast vaults through the air .,416,"balance beam, beam","chair,person,sweeping,floor,woman,jump,edge,edge,edge,edge,edge,street","gymnast,vault,air"
3636796219,Two guys playing baseball .,981,"ballplayer, baseball player","baseball,glove,person,catching,or,throwing,baseball,baseball,player,stand,field","guy,play,baseball"
3638318149,"A young boy playing on his skateboard on a patio of an interesting building , while two people are sitting in chairs in the background .",880,"unicycle, monocycle","chair,person,skateboard,riding,unicycle,man,jump,air","young,boy,play,skateboard,patio,interesting,building,people,sit,chair,background"
3638688673,A boy swings on a swing set .,843,swing,"person,swinging,on,something,man,ride","boy,swing,swing,set"
3639617775,"The bridal party poses with the bride and groom , all wearing black except for the bride .",982,"groom, bridegroom","handbag,person,tie,giving,or,receiving,award,group,people,stand","bridal,party,pose,bride,groom,wear,black,bride"
3639684919,A man and woman in a dark suit and formal white dress smile for a picture .,982,"groom, bridegroom","person,tie,giving,or,receiving,award,man,woman,cut","man,woman,dark,suit,formal,white,dress,smile,picture"
3639691167,two youth football teams playing a game,560,football helmet,"person,passing,American,football,-in,game-,group,people,play,game,football","youth,football,team,play,game"
3640104986,A float depicting religious imagery .,406,altar,"person,clock,dancing,charleston,large,clock,tower,clock","float,depict,religious,imagery"
3640417354,A young girl in a red shirt swings face down on the swings .,843,swing,"car,person,swinging,on,something,person,fly,kite,water","young,girl,red,shirt,swing,face,swing"
36422830,A jeep sidewalks on some rocks .,609,"jeep, landrover","truck,person,driving,car,truck,park,dirt","jeep,sidewalk,rock"
3643074723,"a boy laying on his stomach , on a swing",843,swing,"person,front,raises,man,hold,tennis,ball,ground","boy,lay,stomach,swing"
3643666111,A baseball player slides toward a base as a catcher attempts to catch the ball .,981,"ballplayer, baseball player","sport,ball,baseball,glove,person,catching,or,throwing,baseball,baseball,player,swinge,bat,baseball,game","baseball,player,slide,base,catcher,attempt,catch,ball"
3644941648,A girl is jumping off a high dive in an urban setting .,557,"flagpole, flagstaff","person,jumping,into,pool,man,fly,kite,air","girl,jump,high,dive,urban,setting"
3645162492,a blond child on a horse riding uniform carrying a teddy bear riding a donkey or pony .,452,"bonnet, poke bonnet","person,car,teddy,bear,horse,pushing,wheelchair,young,boy,ride,horse","blond,child,horse,ride,uniform,carry,bear,ride,donkey,pony"
364542005,Cars covered in snow with a man walking with a snow plow on the sidewalk in front of the snow covered vehicles .,621,"lawn mower, mower","car,person,mowing,lawn,man,ride,snowboard,street","car,cover,snow,man,walk,snow,plow,sidewalk,snow,cover,vehicle"
3646453252,A person wearing a red helmet and yellow and white clothing is riding a bike outside in a wooded area .,671,"mountain bike, all-terrain bike, off-roader","bicycle,person,riding,mountain,bike,man,ride,bike,dirt,trail","person,wear,red,helmet,yellow,white,clothing,ride,bike,wooded,area"
3646814919,"A stocky gentleman wearing a long-sleeve , blue shirt , black slacks , aged , black boots and a blue billed cap is scaling a roof , using the structure 's struts to approach stacks of tiles stored at the roof 's apex .",858,tile roof,"person,clock,laying,bricks,man,stand,build","stocky,gentleman,wear,long,sleeve,blue,shirt,black,slack,aged,black,boot,blue,bill,cap,scale,roof,structure,strut,approach,stack,tile,store,roof,apex"
3648160673,A dog jumps of a surfboard,207,golden retriever,"surfboard,bear,catching,fish,dog,ride,water,water","dog,jump,surfboard"
3649307685,Two men playing a game with some sort of sticks .,768,rugby ball,"tennis,racket,person,shaking,hands,man,hold,tennis,racquet,tennis,court","man,play,game,sort,stick"
3649916507,Man riding bike in forest,671,"mountain bike, all-terrain bike, off-roader","bicycle,bottle,person,riding,mountain,bike,man,ride,bike,ground","man,ride,bike,forest"
3650188378,Two people dressed up like the Ghostbusters standing on the sidewalk .,652,military uniform,"car,bus,person,playing,bagpipes,group,people,stand","people,dress,ghostbuster,stand,sidewalk"
3650986674,The black dog and the brown dog are on the ground .,234,Rottweiler,"person,dog,dancing,macarena,dog,stand,water,dog","black,dog,brown,dog,ground"
3653764864,People are walking up a blue railed walkway .,421,"bannister, banister, balustrade, balusters, handrail","backpack,person,pole,vault,group,people,stand,metal,rail","people,walk,blue,rail,walkway"
3653837067,The horse and rider are jumping over a white fence .,354,"Arabian camel, dromedary, Camelus dromedarius","person,horse,riding,elephant,man,ride,horse,bench","horse,rider,jump,white,fence"
3654869593,A few young boys throwing a football over a volleyball net .,890,volleyball,"umbrella,sport,ball,chair,person,playing,volleyball,group,people,beach,kite","young,boy,throw,football,volleyball,net"
3656225270,A girl in red rides on her stomach in a playground swing above a sandy surface .,843,swing,"person,dog,catching,or,throwing,frisbee,person,hold,kite,air","girl,red,ride,stomach,playground,swing,sandy,surface"
365759754,A black dog carries a white toy in his mouth and walks on the snowy field .,205,flat-coated retriever,"dog,passing,American,football,-in,game-,dog,hold,frisbee,water","black,dog,carry,white,toy,mouth,walk,snowy,field"
3658279485,A older man in a hat is playing a accordion on the street while sitting in a chair .,401,"accordion, piano accordion, squeeze box","person,pot,plant,playing,accordion,people,stand,ground,luggage","old,man,hat,play,accordion,street,sit,chair"
3658733605,A boy on a bike jumping .,880,"unicycle, monocycle","bicycle,person,playing,paintball,man,ride,bike,build","boy,bike,jumping"
3661230589,Very excitable man jumping in the air over the double yellow lines on a deserted highway .,880,"unicycle, monocycle","person,laying,bricks,man,ride,bike,road","excitable,man,jump,air,double,yellow,line,deserted,highway"
3661789938,A band playing some music with their instruments .,566,"French horn, horn","chair,laptop,person,playing,trumpet,woman,hold,cell,phone","band,play,music,instrument"
3662865,Two young boys wearing heavy winter clothing shovel snow near some concrete steps .,792,shovel,"snowboard,person,shoveling,snow,snowboarder,stand,snow,snowboard","young,boy,wear,heavy,winter,clothing,shovel,snow,concrete,step"
366454052,A woman ironing a delicate blue fabric .,606,"iron, smoothing iron","chair,person,pot,plant,dining,table,bottle,cup,playing,accordion,woman,sit,table,food","woman,iron,delicate,blue,fabric"
3665169936,A person is doing a trick on a bicycle with grass and sky as the background .,671,"mountain bike, all-terrain bike, off-roader","motorcycle,person,biking,through,snow,man,ride,motorcycle,air","person,trick,bicycle,grass,sky,background"
3666324102,Two girls jump out of swings .,843,swing,"person,handbag,skipping,rope,man,hold,board","girl,jump,swing"
3667035672,A large group of young people are having an outdoor party .,862,torch,"person,handbag,extinguishing,fire,group,people,stand","large,group,young,people,have,outdoor,party"
3667318593,a girl sits on a swing ride .,843,swing,"bench,person,dancing,macarena,fire,hydrant,red,red,fire,hydrant","girl,sit,swing,ride"
